movie_id,title,tags
808396,God Is a Bullet,"Based on true events and the novel of the same name. Vice detective Bob Hightower finds his ex-wife murdered and daughter kidnapped by a cult. Frustrated by the botched official investigations, he quits the force and infiltrates the cult to hunt down the leader with the help of the cult’s only female victim escapee, Case Hardin. Thriller Action Crime Horror MaikaMonroe NikolajCoster-Waldau KarlGlusman JanuaryJones JamieFoxx NickCassavetes"
456483,Wonderwell,"In an idyllic Italian village, a young American girl on the threshold of adolescence is swept into a timeless magical adventure in Wonderwell. Fantasy Family Drama CarrieFisher RitaOra KieraMilward NellTigerFree SebastianCroft VladMarsavin"
335977,Indiana Jones and the Dial of Destiny,"Finding himself in a new era, and approaching retirement, Indy wrestles with fitting into a world that seems to have outgrown him. But as the tentacles of an all-too-familiar evil return in the form of an old rival, Indy must don his hat and pick up his whip once more to make sure an ancient and powerful artifact doesn't fall into the wrong hands. Adventure Action HarrisonFord PhoebeWaller-Bridge MadsMikkelsen BoydHolbrook OlivierRichters JamesMangold"
1040148,"Ruby Gillman, Teenage Kraken","Ruby Gillman, a sweet and awkward high school student, discovers she's a direct descendant of the warrior kraken queens. The kraken are sworn to protect the oceans of the world against the vain, power-hungry mermaids. Destined to inherit the throne from her commanding grandmother, Ruby must use her newfound powers to protect those she loves most. Animation Family Fantasy Comedy LanaCondor ToniCollette AnnieMurphy SamRichardson LizaKoshy KirkDeMicco"
961323,Nimona,"A knight framed for a tragic crime teams with a scrappy, shape-shifting teen to prove his innocence. Animation Fantasy Adventure Comedy Family ChloëGraceMoretz RizAhmed EugeneLeeYang FrancesConroy LorraineToussaint TroyQuane NickBruno"
1070802,Confidential Informant,"During a crack epidemic two narcotics agents hunting for a cop killer. Hoping for leads, Moran and Thorton pay off a junkie informant. To provide for his wife and son, Moran involves the stool pigeon in a deadly scheme. This causes the partners to come under the scrutiny of a suspicious internal affairs agent. Thriller Action Mystery DominicPurcell KateBosworth MelGibson ArielleRaycene NickStahl MichaelOblowitz"
865382,Prisoner's Daughter,"Released from prison with terminal cancer, Max tries to reconnect with his estranged daughter and the grandson he’s never known. When his daughter’s abusive, drug-addicted ex-husband reappears, Max’s violent past comes back to haunt them all. Drama Mystery Thriller KateBeckinsale BrianCox ChristopherConvery TysonRitter ErnieHudson CatherineHardwicke"
1101224,The Unseen,A law student finds himself in a twisted web of murder and deceit brought on by a dark force from his past. Thriller Horror Drama RJMitte ChristianStolte WilliamMarkMcCullough JenniferA.Goodman RebekahKennedy VincentShade
678512,Sound of Freedom,"The story of Tim Ballard, a former US government agent, who quits his job in order to devote his life to rescuing children from global sex traffickers. Action Drama JimCaviezel MiraSorvino BillCamp GerardoTaracena KurtFuller AlejandroGómezMonteverde"
614479,Insidious: The Red Door,"To put their demons to rest once and for all, Josh Lambert and a college-aged Dalton Lambert must go deeper into The Further than ever before, facing their family's dark past and a host of new and more horrifying terrors that lurk behind the red door. Horror Mystery Thriller TySimpkins PatrickWilson RoseByrne LinShaye SinclairDaniel PatrickWilson"
864168,Joy Ride,"When Audrey's business trip to Asia goes sideways, she enlists the aid of Lolo, her irreverent, childhood best friend who also happens to be a hot mess; Kat, her college friend turned Chinese soap star; and Deadeye, Lolo's eccentric cousin. Their no-holds-barred, epic experience becomes a journey of bonding, friendship, belonging, and wild debauchery that reveals the universal truth of what it means to know and love who you are. Comedy AshleyPark SherryCola StephanieHsu SabrinaWu DavidDenman AdeleLim"
921636,The Out-Laws,"A straight-laced bank manager is about to marry the love of his life. When his bank is held up by infamous Ghost Bandits during his wedding week, he believes his future in-laws who just arrived in town, are the infamous Out-Laws. Romance Action Comedy AdamDevine NinaDobrev PierceBrosnan EllenBarkin JulieHagerty TylerSpindel"
980537,Earth Mama,"A pregnant single mother, with two children in foster care, embraces her Bay Area community as she fights to reclaim her family. Drama TiaNomore ErikaAlexander Doechii SharonDuncan-Brewster DominicFike SavanahLeaf"
865797,Biosphere,"In the not-too-distant future, the last two men on earth must adapt and evolve to save humanity. Comedy Drama Science Fiction Fantasy SterlingK.Brown MarkDuplass MelEslyn"
575264,Mission: Impossible - Dead Reckoning Part One,"Ethan Hunt and his IMF team embark on their most dangerous mission yet: To track down a terrifying new weapon that threatens all of humanity before it falls into the wrong hands. With control of the future and the world's fate at stake and dark forces from Ethan's past closing in, a deadly race around the globe begins. Confronted by a mysterious, all-powerful enemy, Ethan must consider that nothing can matter more than his mission—not even the lives of those he cares about most. Action Thriller TomCruise HayleyAtwell VingRhames SimonPegg RebeccaFerguson ChristopherMcQuarrie"
736769,They Cloned Tyrone,A series of eerie events thrusts an unlikely trio onto the trail of a nefarious government conspiracy lurking directly beneath their neighborhood. Comedy Science Fiction Mystery JohnBoyega TeyonahParris JamieFoxx KieferSutherland DavidAlanGrier JuelTaylor
986054,Theater Camp,"After the indomitable and beloved founder of a scrappy theater camp in upstate New York falls into a coma, the eccentric staff must band together with her clueless ""crypto-bro"" son to keep the thespian paradise afloat. Comedy BenPlatt MollyGordon NoahGalvin JimmyTatro CarolineAaron MollyGordon NickLieberman"
346698,Barbie,"Barbie and Ken are having the time of their lives in the colorful and seemingly perfect world of Barbie Land. However, when they get a chance to go to the real world, they soon discover the joys and perils of living among humans. Comedy Adventure Fantasy MargotRobbie RyanGosling AmericaFerrera KateMcKinnon ArianaGreenblatt GretaGerwig"
872585,Oppenheimer,The story of J. Robert Oppenheimer's role in the development of the atomic bomb during World War II. Drama History CillianMurphy EmilyBlunt MattDamon RobertDowneyJr. FlorencePugh ChristopherNolan
926008,The Beanie Bubble,Ty was a frustrated toy salesman until his collaboration with three women turned his stuffed animals into a defining '90s trend. This behind-the-scenes look at history's biggest toy craze is a wild story about what—and who—is valued in this world. Comedy Drama ZachGalifianakis ElizabethBanks SarahSnook GeraldineViswanathan TraceyBonner KristinGore DamianKulash
709631,Cobweb,"Eight year old Peter is plagued by a mysterious, constant tapping from inside his bedroom wall—one that his parents insist is all in his imagination. As Peter's fear intensifies, he believes that his parents could be hiding a terrible, dangerous secret and questions their trustworthiness. Horror LizzyCaplan AntonyStarr CleopatraColeman WoodyNorman LukeBusey SamuelBodin"
616747,Haunted Mansion,A woman and her son enlist a motley crew of so-called spiritual experts to help rid their home of supernatural squatters. Fantasy Comedy Horror Family RosarioDawson ChaseW.Dillon LaKeithStanfield OwenWilson TiffanyHaddish JustinSimien
1030987,Sympathy for the Devil,"After being forced to drive a mysterious passenger at gunpoint, a man finds himself in a high-stakes game of cat and mouse where it becomes clear that not everything is as it seems. Action Thriller NicolasCage JoelKinnaman AlexisZollicoffer CameronLeePrice OliverMcCallum YuvalAdler"
857451,Circus Maximus,"Travis Scott takes his audience on a mind-bending visual odyssey across the globe, woven together by the speaker rattling sounds of his highly anticipated upcoming album ""UTOPIA"". A surreal and psychedelic journey, uniting a collective of visionary filmmakers from around the world in a kaleidoscopic exploration of human experience and the power of soundscapes. Music TravisScott RickRubin JamesBlake SheckWes YungLean GasparNoé NicolasWindingRefn HarmonyKorine KahlilJoseph AndrewDosunmu TravisScott ValdimarJóhannsson"
881209,Happiness for Beginners,"At a crossroads after her divorce, a schoolteacher ventures toward a fresh start in life — and love — when she signs up for a grueling group hiking trip. Romance Adventure Comedy Drama EllieKemper LukeGrimes NicoSantos BlytheDanner BenCook VickyWight"
962566,War Pony,"The interlocking stories of two Lakota boys growing up on Pine Ridge Reservation. At 23, Bill just wants to make something of himself. Meanwhile, 12-year-old Matho can’t wait to become a man. Bound by their shared search for belonging, each of the boys grapple with identity, family, and loss, as they navigate their unique paths to manhood. Drama JojoBapteiseWhiting LaDainianCrazyThunder RobertStover AshleyShelton IonaRedBear RileyKeough GinaGammell"
934606,The Unknown Country,A grieving woman embarks on an unexpected road trip from the Midwest toward the Texas-Mexico border as she grapples with the pain of her recent loss and seeks to understand her place in the world. Drama LilyGladstone RaymondLee RichardRayWhitman LaineyBearkillerShangreaux DevinShangreaux MorrisaMaltz
1103402,Blue Hour: The Disappearance of Nick Brandreth,"True crime documentarian Olivia Brandreth was nine years old when her father disappeared. The official police statement was suicide though no body was ever recovered. Twenty five years later, Olivia has returned to her childhood home to finally get closure in an unrelenting attempt to set the record straight. Blue Hour chronicles the journey of a dedicated film crew in their search to figure out what really happened that night in 1997. Horror Science Fiction Thriller Drama MorganDeTogne MichaelKowalski MikeHeadford NickBrandreth JoshOlkowski DanielBowhers"
614930,Teenage Mutant Ninja Turtles: Mutant Mayhem,"After years of being sheltered from the human world, the Turtle brothers set out to win the hearts of New Yorkers and be accepted as normal teenagers through heroic acts. Their new friend April O'Neil helps them take on a mysterious crime syndicate, but they soon get in over their heads when an army of mutants is unleashed upon them. Animation Comedy Action Science Fiction MicahAbbey ShamonBrownJr. NicolasCantu BradyNoon AyoEdebiri JeffRowe"
615656,Meg 2: The Trench,An exploratory dive into the deepest depths of the ocean of a daring research team spirals into chaos when a malevolent mining operation threatens their mission and forces them into a high-stakes battle for survival. Action Science Fiction Horror JasonStatham WuJing ShuyaSophiaCai PageKennedy SergioPeris-Mencheta BenWheatley
1018754,Shortcomings,"When his girlfriend leaves for New York City on a 3-month-long internship, a strongly opinionated Berkeley arthouse movie theater manager begins exploring life as a bachelor. Comedy Drama Romance JustinH.Min SherryCola AllyMaki TaviGevinson DebbyRyan RandallPark"
887321,Dreamin' Wild,"“Dreamin’ Wild” tells the true story of the Emerson family and the tumult that followed the success of their self-recorded pop-funk album of the same name, which went largely unnoticed until critics rediscovered and reappraised it decades later. Now, as an adult, Donnie is forced to confront the ghosts from the past and grapple with the emotional toll his dreams have taken on the family who supported him. Music Drama CaseyAffleck WaltonGoggins ZooeyDeschanel BeauBridges ChrisMessina BillPohlad"
800279,Corner Office,"In this office satire, Orson, a straight-laced employee, retreats to a blissfully empty corner office to get away from his lackluster colleagues. But why does this seem to upset them so much? Comedy Drama JonHamm DannyPudi SarahGadon ChristopherHeyerdahl AllisonRiley JoachimBack"
1005731,What Comes Around,A young love affair becomes a menacing game of cat and mouse where nothing is what it seems in this immersive thriller. Drama Thriller SummerPhoenix GraceVanDien JesseGarcia KyleGallner IndianaAffleck AmyRedford
957314,The Passenger,"Randolph Bradley is perfectly content fading into the background, but when his coworker Benson snaps and goes on a violent killing spree, he’s forced to face his fears and confront his troubled past in order to find a way to survive. Crime Thriller Horror KyleGallner JohnnyBerchtold LizaWeil BillySlaughter MatthewLaureano CarterSmith"
635910,The Last Voyage of the Demeter,The crew of the merchant ship Demeter attempts to survive the ocean voyage from Carpathia to London as they are stalked each night by a merciless presence onboard the ship. Thriller Horror CoreyHawkins AislingFranciosi DavidDastmalchian JavierBotet LiamCunningham AndréØvredal
724209,Heart of Stone,An intelligence operative for a shadowy global peacekeeping agency races to stop a hacker from stealing its most valuable — and dangerous — weapon. Thriller Action GalGadot JamieDornan AliaBhatt SophieOkonedo MatthiasSchweighöfer TomHarper
930094,"Red, White & Royal Blue","After an altercation between Alex, the president's son, and Britain's Prince Henry at a royal event becomes tabloid fodder, their long-running feud now threatens to drive a wedge in U.S./British relations. When the rivals are forced into a staged truce, their icy relationship begins to thaw and the friction between them sparks something deeper than they ever expected. Comedy Romance TaylorZakharPerez NicholasGalitzine UmaThurman CliftonCollinsJr. RachelHilson MatthewLópez"
1072371,Jules,"A flying saucer lands in the backyard of an elderly suburbanite with memory problems, who forms a bond with the scared alien inside. Science Fiction Comedy Drama BenKingsley HarrietSansomHarris JaneCurtin JadeQuon TeddyCañez MarcTurtletaub"
1020662,Inside Man,"Based on true events, a disgraced police detective seeking redemption by going undercover to expose a violent crime syndicate. But as he sinks deeper into the mob, the price for absolution may be higher than he can afford. Thriller Crime Drama EmileHirsch JakeCannavale LucyHale AshleyGreene DannyA.Abeckaser DannyA.Abeckaser"
565770,Blue Beetle,"Recent college grad Jaime Reyes returns home full of aspirations for his future, only to find that home is not quite as he left it. As he searches to find his purpose in the world, fate intervenes when Jaime unexpectedly finds himself in possession of an ancient relic of alien biotechnology: the Scarab. Action Science Fiction Adventure XoloMariduena BrunaMarquezine SusanSarandon RaoulMaxTrujillo BelissaEscobedo ÁngelManuelSoto"
912908,Strays,"When Reggie is abandoned on the mean city streets by his lowlife owner, Doug, Reggie is certain that his beloved owner would never leave him on purpose. But once Reggie falls in with Bug, a fast-talking, foul-mouthed stray who loves his freedom and believes that owners are for suckers, Reggie finally realizes he was in a toxic relationship and begins to see Doug for the heartless sleazeball that he is. Comedy Adventure WillFerrell JamieFoxx WillForte IslaFisher RandallPark JoshGreenbaum"
832502,The Monkey King,"A stick-wielding monkey teams with a young girl on an epic quest for immortality, battling demons, dragons, gods — and his own ego — along the way. Animation Fantasy Adventure Family Comedy JimmyO.Yang BowenYang JolieHoang-Rappaport JoKoy RonYuan AnthonyStacchi"
777411,Landscape with Invisible Hand,"Years into a benevolent alien occupation, mankind is still adjusting to its new overlords. Their technology initially held promise for global prosperity, but rendered most human jobs – and steady income – obsolete. When two teenagers discover the aliens are fascinated with human love and will pay for access to it, they decide to livestream their romance to make extra cash for their families. Science Fiction Comedy AsanteBlackk KylieRogers TiffanyHaddish BrooklynnMacKinzie JoshHamilton CoryFinley"
943818,Back on the Strip,Aspiring magician Merlin moves to Las Vegas but gets waylaid by his natural gifts and a place with the black male strippers The Chocolate Chips. Comedy WesleySnipes SpenceMooreII KevinHart TiffanyHaddish FaizonLove ChrisSpencer
1077661,The Adults,"Eric returns home for a short visit and finds himself caught between reuniting with his sisters and chasing a victory with his old poker group. As the trip extends, Eric finds it increasingly difficult to avoid confrontations and revelations as his carefully constructed façade of his adulthood gives way to old childhood conflicts. Drama Comedy MichaelCera HannahGross SophiaLillis WavyyJonez AnoopDesai DustinGuyDefa"
980489,Gran Turismo,The ultimate wish-fulfillment tale of a teenage Gran Turismo player whose gaming skills won him a series of Nissan competitions to become an actual professional racecar driver. Adventure Action Drama ArchieMadekwe DavidHarbour OrlandoBloom DjimonHounsou DarrenBarnet NeillBlomkamp
762430,Retribution,"When a mysterious caller puts a bomb under his car seat, Matt Turner begins a high-speed chase across the city to complete a specific series of tasks- all with his kids trapped in the back seat. Action Thriller Crime LiamNeeson NomaDumezweni LillyAspell JackChampion ArianMoayed NimródAntal"
869641,Vacation Friends 2,"Newly married couple Marcus and Emily invite their uninhibited besties Ron and Kyla to join them for a vacation when Marcus lands an all-expenses-paid trip to a Caribbean resort. When Kyla’s incarcerated father Reese is released and shows up at the resort unannounced, things get out of control, upending Marcus’ best laid plans and turning the vacation friends’ perfect trip into total chaos. Comedy LilRelHowery YvonneOrji JohnCena MeredithHagner SteveBuscemi ClayTarver"
999644,You Are So Not Invited to My Bat Mitzvah,Stacy and Lydia are BFFs who've always dreamed about having epic bat mitzvahs. But things start to go comically awry when a popular boy and middle school drama threatens their friendship and their rite of passage. Comedy IdinaMenzel JackieSandler AdamSandler SadieSandler SunnySandler SammiCohen
814776,Bottoms,Unpopular best friends PJ and Josie start a high school self-defense club to meet girls and lose their virginity. They soon find themselves in over their heads when the most popular students start beating each other up in the name of self-defense. Comedy RachelSennott AyoEdebiri RubyCruz HavanaRoseLiu KaiaGerber EmmaSeligman
899524,Golda,"Set during the tense 19 days of the Yom Kippur War in 1973, Israeli Prime Minister Golda Meir is faced with the potential of Israel’s complete destruction. She must navigate overwhelming odds, a skeptical cabinet and a complex relationship with US Secretary of State Henry Kissinger, with millions of lives in the balance. Her tough leadership and compassion would ultimately decide the fate of her nation and leave her with a controversial legacy around the world. History Drama Thriller HelenMirren CamilleCottin LievSchreiber LiorAshkenazi RamiHeuberger GuyNattiv"
862557,The Hill,"The story of Rickey Hill, who overcomes his physical disability and repairs his relationship with his father in a quest to become a major league baseball (MLB) player. History Drama ColinFord DennisQuaid JoelleCarter ScottGlenn SienaBjornerud JeffCelentano"
926393,The Equalizer 3,"Robert McCall finds himself at home in Southern Italy but he discovers his friends are under the control of local crime bosses. As events turn deadly, McCall knows what he has to do: become his friends' protector by taking on the mafia. Action Thriller Crime DenzelWashington DakotaFanning EugenioMastrandrea DavidDenman GaiaScodellaro AntoineFuqua"
996347,The Good Mother,"A journalist and his pregnant girlfriend attempt to track down those responsible for the murder of his estranged son. Together, they confront a world of drugs and corruption in the underbelly of their small city in upstate New York, where they uncover an even darker secret. Mystery Thriller Crime Drama HilarySwank OliviaCooke JackReynor Dilone HopperPenn MilesJoris-Peyrafitte"
926599,All Fun and Games,"A group of Salem teens discover a cursed knife that unleashes a demon that forces them to play gruesome, deadly versions of childhood games where there can be no winners, only survivors. Horror Thriller AsaButterfield NataliaDyer BenjaminEvanAinsworth LaurelMarsden AnnabethGish ErenCeleboglu AriCosta"
968051,The Nun II,"In 1956 France, a priest is violently murdered, and Sister Irene begins to investigate. She once again comes face-to-face with a powerful evil. Horror Mystery Thriller TaissaFarmiga JonasBloquet StormReid AnnaPopplewell BonnieAarons MichaelChaves"
1001811,My Big Fat Greek Wedding 3,"Following the death of their patriarch Gus, the Portokalos family travels to Greece for a family reunion, and to deliver Gus' journal to his old friends. Comedy Romance NiaVardalos JohnCorbett ElenaKampouris LainieKazan AndreaMartin NiaVardalos"
936952,Sitting in Bars with Cake,"Extrovert Corinne convinces Jane, a shy, talented baker, to commit to a year of bringing cakes to bars, to help her meet people and build confidence. But when Corinne receives a life-altering diagnosis, the pair faces a challenge unlike anything they've experienced before. Romance Comedy Drama YaraShahidi OdessaA'zion BetteMidler RonLivingston MaiaMitchell TrishSie"
500104,Aristotle and Dante Discover the Secrets of the Universe,"Two teenage Mexican-American loners in 1987 El Paso explore a new, unusual friendship and the difficult road to self-discovery. Drama Romance MaxPelayo ReeseGonzales EugenioDerbez VeronicaFalcón KevinAlejandro AitchAlberto"
820525,After Everything,"Besieged by writer’s block and the crushing breakup with Tessa, Hardin travels to Portugal in search of a woman he wronged in the past – and to find himself. Hoping to win back Tessa, he realizes he needs to change his ways before he can make the ultimate commitment. Romance Drama HeroFiennesTiffin JosephineLangford MimiKeene StephenMoyer LouiseLombard CastilleLandon"
945729,A Haunting in Venice,"Celebrated sleuth Hercule Poirot, now retired and living in self-imposed exile in Venice, reluctantly attends a Halloween séance at a decaying, haunted palazzo. When one of the guests is murdered, the detective is thrust into a sinister world of shadows and secrets. Mystery Thriller Crime KennethBranagh KyleAllen CamilleCottin JamieDornan TinaFey KennethBranagh"
792293,Dumb Money,"Vlogger Keith Gill sinks his life savings into GameStop stock and posts about it. When social media starts blowing up, so do his life and the lives of everyone following him. As a stock tip becomes a movement, everyone gets rich—until the billionaires fight back, and both sides find their worlds turned upside down. Comedy Drama History PaulDano ShaileneWoodley AmericaFerrera PeteDavidson SethRogen CraigGillespie"
353577,Love at First Sight,"Hadley and Oliver begin falling in love on a flight from New York to London, but when they lose each other at customs, can they defy all odds to reunite? Romance Drama HaleyLuRichardson BenHardy RobDelaney KatrinaNare JameelaJamil VanessaCaswill"
1002185,A Million Miles Away,"The life of engineer and former NASA astronaut José M. Hernández, the first migrant farmworker to go to space. Drama History MichaelPeña RosaSalazar JulioCedillo VeronicaFalcón JuanpiMonterrubio AlejandraMárquezAbella"
866346,The Retirement Plan,"When Ashley and her young daughter Sarah get caught up in a criminal enterprise that puts their lives at risk, she turns to the only person who can help: her estranged father Matt, currently living the life of a retired beach bum in the Cayman Islands. Their reunion is fleeting as they are soon tracked down on the island by crime boss Donnie and his lieutenant Bobo. As Ashley, Sarah, and Matt become entangled in an increasingly dangerous web, Ashley quickly learns her father had a secret past that she knew nothing about and that there is more to her father than meets the eye. Comedy Action NicolasCage AshleyGreene ThaliaCampbell RonPerlman JackieEarleHaley TimBrown"
889450,The Outlaw Johnny Black,"Hell bent on avenging the death of his father, Johnny Black vows to gun down Brett Clayton and becomes a wanted man in the process while posing as a preacher in a small mining town that's been taken over by a notorious Land Baron. Action Comedy Western MichaelJaiWhite AnikaNoniRose EricaAsh ByronMinns KevinChapman MichaelJaiWhite"
917594,Camp Hideout,"Noah is a troubled teen who nearly gets caught stealing a top-secret gadget from some big city thugs. After barely escaping, he decides to hide out at a summer camp that's run by the eccentric Falco and counselors Jake and Selena. As Noah tries to blend in with the rest of the rowdy campers, his crooked partners show up to steal the classified item, now in his possession. Family Comedy CorbinBleu EthanDrew AmandaLeighton ChristopherLloyd TylerKowalski SeanOlson"
299054,Expend4bles,"Armed with every weapon they can get their hands on and the skills to use them, The Expendables are the world’s last line of defense and the team that gets called when all other options are off the table. But new team members with new styles and tactics are going to give “new blood” a whole new meaning. Action Adventure Thriller SylvesterStallone JasonStatham 50Cent MeganFox DolphLundgren ScottWaugh"
