movie_id,title,tags
964980,Air,Discover the game-changing partnership between a then undiscovered Michael Jordan and Nike's fledgling basketball division which revolutionized the world of sports and culture with the Air Jordan brand. Drama History MattDamon BenAffleck JasonBateman ChrisMessina ViolaDavis BenAffleck
551806,Praise This,"When aspiring musical superstar Sam is forced to join her cousin's struggling, underdog praise team in the lead-up to a national championship competition, she sees an opportunity to finally make her dreams come true. Music Romance Comedy ChloeBailey AnjelikaWashington Druski BirgundiBaker JekalynCarr TinaGordonChism"
790416,Showing Up,"In the days leading up to a possibly career-changing exhibition, a sculptor navigates her relationships with family, friends, and colleagues. Comedy Drama MichelleWilliams HongChau MaryannPlunkett JohnMagaro André3000 KellyReichardt"
821890,Paint,"Carl Nargle, Vermont’s #1 public television painter, is convinced he has it all: a signature perm, custom van, and fans hanging on his every stroke… until a younger, better artist steals everything (and everyone) Carl loves. Comedy Drama OwenWilson MichaelaWatkins WendiMcLendon-Covey CiaraRenée LusiaStrus BritMcAdams"
878375,On a Wing and a Prayer,"After their pilot dies unexpectedly mid-flight, passenger Doug White must safely land a plane and save his entire family from insurmountable danger. Drama DennisQuaid HeatherGraham JesseMetcalfe AbbeyRhyne JessiCase SeanMcNamara"
736790,Chupa,"While visiting family in Mexico, a lonely boy befriends a mythical creature hiding on his grandfather's ranch and embarks on the adventure of a lifetime. Adventure Fantasy Family EvanWhitten DemiánBichir ChristianSlater AshleyCiarra JulioCedillo JonásCuarón"
1008048,How to Blow Up a Pipeline,A crew of young environmental activists execute a daring mission to sabotage an oil pipeline. Crime Drama Thriller ArielaBarer KristineFroseth LukasGage ForrestGoodluck SashaLane DanielGoldhaber
846961,One True Loves,"Emma and Jesse are living the perfect life together, until Jesse disappears in a tragic helicopter crash on their first wedding anniversary. Four years later, Emma has found happiness again and is about to marry her best friend when Jesse resurfaces, turning her world upside down and leaving her torn between two great loves. Romance Drama Comedy PhillipaSoo SimuLiu LukeBracey MichaelaConlin TomEverettScott AndyFickman"
1016121,Beautiful Disaster,"Bad-boy Travis is exactly what college freshman Abby needs and wants to avoid. He spends his nights fighting in underground boxing matches, and his days as the ultimate college campus charmer. But Abby wants nothing to do with Travis. Intrigued by Abby’s resistance, Travis offers her a simple bet: if he loses his next fight, he must remain sex-free for a month. If he wins, Abby must live in his apartment for the same amount of time. Either way, Travis has no idea that Abby’s dark past is about to emerge, and he may have finally met his match. Romance Drama Comedy DylanSprouse VirginiaGardner AustinNorth LibeBarer RobEstes RogerKumble"
649609,Renfield,"Having grown sick and tired of his centuries as Dracula's lackey, Renfield finds a new lease on life — and maybe even redemption — when he falls for feisty, perennially angry traffic cop Rebecca Quincy. Comedy Horror Fantasy NicholasHoult NicolasCage Awkwafina BenSchwartz ShohrehAghdashloo ChrisMcKay"
798286,Beau Is Afraid,A paranoid man embarks on an epic odyssey to get home to his mother. Comedy Adventure Fantasy JoaquinPhoenix PattiLuPone AmyRyan NathanLane KylieRogers AriAster
758323,The Pope's Exorcist,"Father Gabriele Amorth, Chief Exorcist of the Vatican, investigates a young boy's terrifying possession and ends up uncovering a centuries-old conspiracy the Vatican has desperately tried to keep hidden. Horror Thriller RussellCrowe DanielZovatto AlexEssoe FrancoNero PeterDeSouza-Feighoney JuliusAvery"
809787,Mafia Mamma,"A suburban American woman inherits her grandfather’s Mafia empire and, guided by the Firm’s trusted consigliere, defies everyone’s expectations, including her own, as the new head of the family business. Comedy Action Crime ToniCollette MonicaBellucci SophiaNomvete AlessandroBressanello EduardoScarpetta CatherineHardwicke"
987257,Sweetwater,"In 1990 Chicago, a taxi driver recounts to his passenger, a sportswriter, his life story. He reveals himself to be Nat ""Sweetwater"" Clifton, one of the first African Americans to play in the NBA. Drama History EverettOsborne CaryElwes JeremyPiven EricRoberts JimCaviezel MartinGuigui"
913673,Nefarious,"On the day of his scheduled execution, a convicted serial killer gets a psychiatric evaluation during which he claims he is a demon, and further claims that before their time is over, the psychiatrist will commit three murders of his own. Horror Thriller SeanPatrickFlanery JordanBelfi TomOhmer GlennBeck DanielMartinBerkey CarySolomon ChuckKonzelman"
899328,Rare Objects,A young woman with a traumatic past seeks to rebuild her life when she begins working at a New York City antique shop. Drama JuliaMayorga KatieHolmes DerekLuke AlanCumming SaundraSantiago KatieHolmes
893752,Quasi,"A hapless hunchback who only yearns for love, finds himself in the middle of a murderous feud between the Pope and the King of France when each orders the hunchback to kill the other. Comedy Drama BrianCox KevinHeffernan SteveLemme JayChandrasekhar PaulSoter KevinHeffernan"
713704,Evil Dead Rise,"A reunion between two estranged sisters gets cut short by the rise of flesh-possessing demons, thrusting them into a primal battle for survival as they face the most nightmarish version of family imaginable. Horror Thriller LilySullivan AlyssaSutherland MorganDavies GabrielleEchols NellFisher LeeCronin"
882569,Guy Ritchie's The Covenant,"During the war in Afghanistan, a local interpreter risks his own life to carry an injured sergeant across miles of grueling terrain. War Action Thriller JakeGyllenhaal DarSalim SeanSagar JasonWong RhysYates GuyRitchie"
868759,Ghosted,"Salt-of-the-earth Cole falls head over heels for enigmatic Sadie — but then makes the shocking discovery that she’s a secret agent. Before they can decide on a second date, Cole and Sadie are swept away on an international adventure to save the world. Action Comedy Romance ChrisEvans AnadeArmas AdrienBrody MikeMoh AmySedaris DexterFletcher"
812635,Chevalier,"The illegitimate son of an African slave and a French plantation owner, Bologne rises to improbable heights in French society as a celebrated violinist-composer and fencer, complete with an ill-fated love affair and a falling out with Marie Antoinette and her court. Inspired by the incredible true story of composer Joseph Bologne, Chevalier de Saint-Georges. Music Drama History KelvinHarrisonJr. SamaraWeaving LucyBoynton AlexFitzalan MinnieDriver StephenWilliams"
829774,Somewhere in Queens,"Leo and Angela Russo live a simple life in Queens, surrounded by their overbearing Italian-American family. When their son finds success on his high school basketball team, Leo tears the family apart trying to make it happen. Comedy Drama RayRomano LaurieMetcalf JacobWard SadieStanley JenniferEsposito RayRomano"
763261,Carmen,"A young and fiercely independent woman, Carmen, is forced to flee her home in the Mexican desert following the brutal murder of her mother. She survives an illegal border crossing into the US, only to be confronted by a lawless volunteer border guard. When the border guard and his patrol partner Aidan become embroiled in a deadly standoff, the pair is forced to escape together. Drama Music MelissaBarrera PaulMescal RossydePalma ElsaPataky NicoledaSilva BenjaminMillepied"
813726,A Tourist's Guide to Love,"After an unexpected break up, a travel executive accepts an assignment to go undercover and learn about the tourist industry in Vietnam. Along the way, she finds adventure and romance with her Vietnamese expat tour guide and they decide to hijack the tour bus in order to explore life and love off the beaten path. Romance Comedy Adventure RachaelLeighCook ScottLy MissiPyle BenFeldman GlynnSweet StevenK.Tsuchida"
983282,The Artifice Girl,"A team of special agents discovers a revolutionary new computer program to bait and trap online predators. After teaming up with the program's troubled developer, they soon find that the AI is rapidly advancing beyond its original purpose. Science Fiction Thriller Drama Mystery TatumMatthews DavidGirard SindaNichols FranklinRitch LanceHenriksen FranklinRitch"
420808,Peter Pan & Wendy,"Wendy Darling, a young girl afraid to leave her childhood home behind, meets Peter Pan, a boy who refuses to grow up. Alongside her brothers and a tiny fairy, Tinker Bell, she travels with Peter to the magical world of Neverland. There, she encounters an evil pirate captain, Captain Hook, and embarks on a thrilling adventure that will change her life forever. Family Fantasy Action Adventure AlexanderMolony EverAnderson JudeLaw AlyssaWapanatâhk JimGaffigan DavidLowery"
555285,"Are You There God? It's Me, Margaret.","When her family moves from New York City to New Jersey, an 11-year-old girl navigates new friends, feelings, and the beginning of adolescence. Comedy Drama RachelMcAdams AbbyRyderFortson KathyBates ElleGraham BennySafdie KellyFremonCraig"
878361,Big George Foreman,"Fueled by an impoverished childhood, George Foreman channeled his anger into becoming an Olympic Gold medalist and World Heavyweight Champion, followed by a near-death experience that took him from the boxing ring to the pulpit. But when he sees his community struggling spiritually and financially, Foreman returns to the ring and makes history by reclaiming his title, becoming the oldest and most improbable World Heavyweight Boxing Champion ever. Drama History KhrisDavis ForestWhitaker SullivanJones DeionSmith MatthewGlave GeorgeTillmanJr."
840326,Sisu,"Deep in the wilderness of Lapland, Aatami Korpi is searching for gold but after he stumbles upon Nazi patrol, a breathtaking and gold-hungry chase through the destroyed and mined Lapland wilderness begins. Action War JormaTommila AkselHennie JackDoolan MimosaWillamo OnniTommila JalmariHelander"
1085103,Clock,"On the eve of her 38th birthday, a woman desperately attempts to fix her broken biological clock. Horror Thriller DiannaAgron MeloraHardin JayAli GracePorter SaulRubinek AlexisJacknow"
447365,Guardians of the Galaxy Vol. 3,"Peter Quill, still reeling from the loss of Gamora, must rally his team around him to defend the universe along with protecting one of their own. A mission that, if not completed successfully, could quite possibly lead to the end of the Guardians as we know them. Science Fiction Adventure Action ChrisPratt ZoeSaldaña DaveBautista KarenGillan PomKlementieff JamesGunn"
758336,Love Again,"Mira Ray, dealing with the loss of her fiancé, sends a series of romantic texts to his old cell phone number… not realizing the number was reassigned to Rob Burns' new work phone. A journalist, Rob is captivated by the honesty in the beautifully confessional texts. When he’s assigned to write a profile of megastar Céline Dion, he enlists her help in figuring out how to meet Mira in person and win her heart. Romance Drama Comedy PriyankaChopraJonas SamHeughan CélineDion SofiaBarclay RussellTovey JimStrouse"
982271,Book Club: The Next Chapter,"Four best friends take their book club to Italy for the fun girls' trip they never had. When things go off the rails and secrets are revealed, their relaxing vacation turns into a once-in-a-lifetime cross-country adventure. Comedy Romance DianeKeaton JaneFonda CandiceBergen MarySteenburgen AndyGarcía BillHolderman"
552688,The Mother,"A deadly female assassin comes out of hiding to protect the daughter that she gave up years before, while on the run from dangerous men. Action Thriller JenniferLopez LucyPaez OmariHardwick JosephFiennes GaelGarcíaBernal NikiCaro"
553147,Fool's Paradise,"A down-on-his-luck publicist discovers a recently released mental health patient who looks just like a misbehaving movie star. The publicist subs him into a film, creating a new star. But fame and fortune are not all they are cracked up to be. Comedy CharlieDay KenJeong KateBeckinsale AdrienBrody JasonSudeikis CharlieDay"
536437,Hypnotic,A detective becomes entangled in a mystery involving his missing daughter and a secret government program while investigating a string of reality-bending crimes. Mystery Thriller Action Science Fiction BenAffleck AliceBraga J.D.Pardo DayoOkeniyi JeffFahey RobertRodriguez
620705,Crater,"After the death of his father, a boy growing up on a lunar mining colony takes a trip to explore a legendary crater, along with his four best friends, prior to being permanently relocated to another planet. Science Fiction Action Adventure Family IsaiahRussell-Bailey MckennaGrace BillyBarratt OrsonHong ThomasBoyce KylePatrickAlvarez"
455476,Knights of the Zodiac,"When a headstrong street orphan, Seiya, in search of his abducted sister unwittingly taps into hidden powers, he discovers he might be the only person alive who can protect a reincarnated goddess, sent to watch over humanity. Can he let his past go and embrace his destiny to become a Knight of the Zodiac? Fantasy Action Adventure Mackenyu MadisonIseman DiegoTinoco MarkDacascos NickStahl TomekBaginski"
540549,Monica,"After years of estrangement, a trans woman returns home to help care for her dying mother. Drama TraceLysette PatriciaClarkson EmilyBrowning JoshuaClose AdrianaBarraza AndreaPallaoro"
1001500,The Starling Girl,17-year-old Jem Starling struggles with her place within her Christian fundamentalist community. But everything changes when her magnetic youth pastor Owen returns to their church. Drama ElizaScanlen LewisPullman WrennSchmidt JimmiSimpson ClaireElizabethGreen LaurelParmet
1008102,Rally Road Racers,"Zhi, a rookie race car driver, gets the opportunity to compete against the reigning champion of the rally car circuit. With help from a former driver-turned-mechanic, Zhi must overcome treacherous terrain, rival racers, and unexpected obstacles to prove he has what it takes to be the next great racer. Animation Family Comedy JimmyO.Yang LisaLu ChloeBennet J.K.Simmons CatherineTate RossVenokur"
385687,Fast X,"Over many missions and against impossible odds, Dom Toretto and his family have outsmarted, out-nerved and outdriven every foe in their path. Now, they confront the most lethal opponent they've ever faced: A terrifying threat emerging from the shadows of the past who's fueled by blood revenge, and who is determined to shatter this family and destroy everything—and everyone—that Dom loves, forever. Action Crime Thriller VinDiesel MichelleRodriguez TyreseGibson Ludacris JohnCena LouisLeterrier"
920125,White Men Can't Jump,"Seemingly opposite street hoopers, Jeremy, an injury prone former star, and Kamal, a has-been prodigy, team up to take one final shot at living out their dreams. Comedy Drama JackHarlow SinquaWalls LauraHarrier TeyanaTaylor LanceReddick Calmatic"
869612,Master Gardener,"Narvel Roth is a meticulous horticulturist who is devoted to tending the grounds of a beautiful estate and pandering to his employer, the wealthy dowager Mrs. Haverhill. When she demands that he take on her wayward and troubled niece, it unlocks dark secrets from a buried violent past. Drama Romance Thriller JoelEdgerton SigourneyWeaver QuintessaSwindell EsaiMorales EduardoLosan PaulSchrader"
870518,Sanctuary,"Confined to a claustrophobic hotel room, the heir to a hotel empire and the dominatrix who has primed him for success become locked in a battle of wits and wills as he tries to end his relationship with her. Thriller Comedy Drama MargaretQualley ChristopherAbbott DanitaBattle ReneCalvo ChristianCasatelli ZacharyWigon"
723347,Robots,"A womanizer and a gold digger trick people into relationships with illegal robot doubles. When they unwittingly use this scam on each other, their robot doubles fall in love and elope, forcing the duo to team up to hunt them down before the authorities discover their secret. Comedy Science Fiction Romance Fantasy ShaileneWoodley JackWhitehall PaulRust NickRutherford PaulJurewicz AnthonyHines CasperChristensen"
977000,Moon Garden,"A comatose five-year-old girl journeys through a dark industrial dreamscape, following her mother's voice on a transistor radio to find her way back to consciousness. Fantasy Horror Drama AugieDuke BrionneDavis HavenLeeHarris MorganaIgnis MariaOlsen RyanStevensHarris"
447277,The Little Mermaid,"The youngest of King Triton’s daughters, and the most defiant, Ariel longs to find out more about the world beyond the sea, and while visiting the surface, falls for the dashing Prince Eric. With mermaids forbidden to interact with humans, Ariel makes a deal with the evil sea witch, Ursula, which gives her a chance to experience life on land, but ultimately places her life – and her father’s crown – in jeopardy. Adventure Family Fantasy Romance HalleBailey JonahHauer-King DaveedDiggs Awkwafina JacobTremblay RobMarshall"
829051,About My Father,"Encouraged by his fiancee, a man and his father spend the weekend with her wealthy and exceedingly eccentric family. The gathering soon develops into a culture clash, allowing father and son to discover the true meaning of family. Comedy SebastianManiscalco RobertDeNiro LeslieBibb AndersHolm DavidRasche LauraTerruso"
717930,Kandahar,"After his mission is exposed, an undercover CIA operative stuck deep in hostile territory in Afghanistan must fight his way out, alongside his Afghan translator, to an extraction point in Kandahar, all whilst avoiding elite enemy forces and foreign spies tasked with hunting them down. Action Thriller GerardButler NavidNegahban TravisFimmel AliFazal BahadorFoladi RicRomanWaugh"
647250,The Machine,"Bert Kreischer faces a familial crisis and the arrival of his estranged father when the ghost of his booze-soaked past arrives: a murderous mobster hellbent on kidnapping Bert back to the motherland to atone for his crimes. Together, he and his father must retrace the steps of his younger self in the midst of a war between a sociopathic crime family while they attempt to find common ground. Comedy Action Crime BertKreischer MarkHamill JimmyTatro StephanieKurtzuba NikolaĐuričko PeterAtencio"
890215,You Hurt My Feelings,A novelist's longstanding marriage is suddenly upended when she overhears her husband giving his honest reaction to her latest book. Comedy Drama Romance JuliaLouis-Dreyfus TobiasMenzies MichaelaWatkins ArianMoayed OwenTeague NicoleHolofcener
986070,The Wrath of Becky,"Two years after she escaped a violent attack on her family, 16-year-old Becky attempts to rebuild her life in the care of an older woman -- a kindred spirit named Elena. However, when a violent group known as the Noble Men break into their home, attack them and take their beloved dog, Becky must return to her old ways to protect herself and her loved ones. Action Horror Thriller LuluWilson SeannWilliamScott DeniseBurse JillLarson MichaelSirow MattAngel SuzanneCoote"
985617,Reality,"Augusta, Georgia, United States, June 3, 2017. After running some errands, Reality Winner returns home, where she is approached by two men. Drama Thriller SydneySweeney JoshHamilton MarchántDavis BennyElledge JohnWay TinaSatter"
569094,Spider-Man: Across the Spider-Verse,"After reuniting with Gwen Stacy, Brooklyn’s full-time, friendly neighborhood Spider-Man is catapulted across the Multiverse, where he encounters the Spider Society, a team of Spider-People charged with protecting the Multiverse’s very existence. But when the heroes clash on how to handle a new threat, Miles finds himself pitted against the other Spiders and must set out on his own to save those he loves most. Animation Action Adventure Science Fiction ShameikMoore HaileeSteinfeld JasonSchwartzman OscarIsaac BrianTyreeHenry JoaquimDosSantos JustinK.Thompson KempPowers"
532408,The Boogeyman,"Still reeling from the tragic death of their mother, a teenage girl and her younger sister find themselves plagued by a sadistic presence in their house and struggle to get their grieving father to pay attention before it’s too late. Horror Thriller Mystery SophieThatcher VivienLyraBlair ChrisMessina DavidDastmalchian MarinIreland RobSavage"
666277,Past Lives,"Nora and Hae Sung, two childhood friends, are reunited in New York for one fateful week as they confront notions of destiny, love, and the choices that make a life. Drama Romance GretaLee TeoYoo JohnMagaro MoonSeung-ah YimSeung-min CelineSong"
970284,Shooting Stars,"The inspiring origin story of a basketball superhero, revealing how LeBron James and his childhood friends become the #1 high school team in the country, launching James's breathtaking career as a four-time NBA Champion, two-time Olympic Gold Medalist and the NBA's all-time leading scorer. Drama MookieCook CalebMcLaughlin AlgeeSmith DermotMulroney WoodHarris ChrisRobinson"
667538,Transformers: Rise of the Beasts,"When a new threat capable of destroying the entire planet emerges, Optimus Prime and the Autobots must team up with a powerful faction known as the Maximals. With the fate of humanity hanging in the balance, humans Noah and Elena will do whatever it takes to help the Transformers as they engage in the ultimate battle to save Earth. Action Adventure Science Fiction AnthonyRamos DominiqueFishback PeterCullen RonPerlman PeterDinklage StevenCapleJr."
626332,Flamin' Hot,"The inspiring true story of Richard Montañez, the Frito Lay janitor who channeled his Mexican American heritage and upbringing to turn the iconic Flamin’ Hot Cheetos into a snack that disrupted the food industry and became a global pop culture phenomenon. Comedy Drama JesseGarcia AnnieGonzalez EmilioRivera VanessaMartinez DennisHaysbert EvaLongoria"
1115939,Jagged Mind,"When Billie finds herself reliving different versions of the same first date, she must break out of a series of loops created by her manipulative ex-girlfriend. Horror MaisieRichardson-Sellers ShannonWoodward RosalineElbay KateSzekely JimmyJean-Louis KelleyKali"
298618,The Flash,"When his attempt to save his family inadvertently alters the future, Barry Allen becomes trapped in a reality in which General Zod has returned and there are no Super Heroes to turn to. In order to save the world that he is in and return to the future that he knows, Barry's only hope is to race for his life. But will making the ultimate sacrifice be enough to reset the universe? Action Adventure Science Fiction EzraMiller SashaCalle MichaelKeaton MichaelShannon RonLivingston AndyMuschietti"
976573,Elemental,"In a city where fire, water, land and air residents live together, a fiery young woman and a go-with-the-flow guy will discover something elemental: how much they have in common. Animation Comedy Family Fantasy Romance LeahLewis MamoudouAthie RonniedelCarmen ShilaOmmi WendiMcLendon-Covey PeterSohn"
747188,Asteroid City,"In an American desert town circa 1955, the itinerary of a Junior Stargazer/Space Cadet convention is spectacularly disrupted by world-changing events. Comedy Drama JasonSchwartzman ScarlettJohansson TomHanks JeffreyWright TildaSwinton WesAnderson"
697843,Extraction 2,"Tasked with extracting a family who is at the mercy of a Georgian gangster, Tyler Rake infiltrates one of the world's deadliest prisons in order to save them. But when the extraction gets hot, and the gangster dies in the heat of battle, his equally ruthless brother tracks down Rake and his team to Vienna, in order to get revenge. Action Thriller ChrisHemsworth GolshiftehFarahani AdamBessa TornikeGogrichiani TornikeBziava SamHargrave"
1008392,The Blackening,"Seven black friends go away for the weekend, only to find themselves trapped in a cabin with a killer who has a vendetta. They must pit their street smarts and knowledge of horror movies against the murderer to stay alive. Horror Comedy AntoinetteRobertson SinquaWalls DewaynePerkins XMayo MelvinGregg TimStory"
759584,Surrounded,"After her stagecoach is ambushed, a woman is tasked with holding a dangerous outlaw captive and must survive the day when the bandit’s gang tries to free him. Western Action Drama LetitiaWright JamieBell MichaelKennethWilliams JeffreyDonovan KevinWiggins AnthonyMandler"
884605,No Hard Feelings,"On the brink of losing her childhood home, Maddie discovers an intriguing job listing: wealthy helicopter parents looking for someone to “date” their introverted 19-year-old son, Percy, before he leaves for college. To her surprise, Maddie soon discovers the awkward Percy is no sure thing. Comedy Romance JenniferLawrence AndrewBarthFeldman LauraBenanti MatthewBroderick NatalieMorales GeneStupnitsky"
561717,The Perfect Find,"After a high-profile firing, everything is at stake for 40-year-old Jenna: her career, her ticking biological clock, and her bank account. Her fashion career comeback hits a snag when she falls for a charming, much younger coworker — who happens to be her boss’s son. As sparks fly, Jenna must decide if she’ll risk it all on a secret romance with the one person who could destroy her comeback. Romance Comedy GabrielleUnion KeithPowers GinaTorres AishaHinds LaLaAnthony NumaPerrier"
929569,World's Best,"Twelve-year-old mathematics genius Prem discovers his recently deceased father was a famous rapper and immediately sets out to learn more about his father’s life and passions. Empowered by imaginative hip-hop music-fueled fantasies, Prem is determined to find out if hip-hop truly is in his DNA. Music Family Comedy MannyMagnus PunamPatel UtkarshAmbudkar MaxMalas JakeChoi RoshanSethi"
