movie_id,title,tags
454458,UglyDolls,"In the adorably different town of Uglyville, weirdness is celebrated, strangeness is special and beauty is embraced as more than meets the eye. After traveling to the other side of a mountain, Moxy and her UglyDoll friends discover Perfection -- a town where more conventional dolls receive training before entering the real world to find the love of a child. Family Animation Music KellyClarkson NickJonas JanelleMonáe BlakeShelton LeehomWang KellyAsbury"
457799,"Extremely Wicked, Shockingly Evil and Vile","A chronicle of the crimes of Ted Bundy, from the perspective of his longtime girlfriend, Elizabeth Kloepfer, who refused to believe the truth about him for years. Crime ZacEfron LilyCollins KayaScodelario JohnMalkovich JimParsons JoeBerlinger"
502292,The Last Summer,"Standing on the precipice of adulthood, a group of friends navigate new relationships, while reexamining others, during their final summer before college. Romance Comedy K.J.Apa MaiaMitchell JacobLatimore HalstonSage TylerPosey WilliamBindley"
447404,Pokémon Detective Pikachu,"In a world where people collect pocket-size monsters (Pokémon) to do battle, a boy comes across an intelligent monster who seeks to be a detective. Action Adventure Fantasy RyanReynolds JusticeSmith KathrynNewton SukiWaterhouse OmarChaparro RobLetterman"
449562,The Hustle,"Two female scam artists, one low rent and the other high class, compete to swindle a naïve tech prodigy out of his fortune. A remake of the 1988 comedy ""Dirty Rotten Scoundrels."" Comedy Crime AnneHathaway RebelWilson AlexSharp IngridOliver HannahWaddingham ChrisAddison"
468224,Tolkien,"England, early 20th century. The future writer and philologist John Ronald Reuel Tolkien (1892-1973) and three of his schoolmates create a strong bond between them as they share the same passion for literature and art, a true fellowship that strengthens as they grow up, but the outbreak of World War I threatens to shatter it. War Drama Romance NicholasHoult LilyCollins ColmMeaney DerekJacobi HarryGilby DomeKarukoski"
574241,Poms,"After moving to a retirement community, loner Martha eventually befriends her fun-loving neighbor, Sheryl, and forms a cheerleading club for young-at-heart seniors, though they face roadblocks along the way. Comedy Drama DianeKeaton JackiWeaver CeliaWeston AlishaBoe CharlieTahan ZaraHayes"
411728,The Professor and the Madman,"Professor James Murray begins work compiling words for the first edition of the Oxford English Dictionary in the mid 19th century, and receives over 10,000 entries from a patient at Broadmoor Criminal Lunatic Asylum, Dr. William Minor. History Drama Mystery Thriller MelGibson SeanPenn EddieMarsan NatalieDormer IoanGruffudd FarhadSafinia"
458156,John Wick: Chapter 3 - Parabellum,"Super-assassin John Wick returns with a $14 million price tag on his head and an army of bounty-hunting killers on his trail. After killing a member of the shadowy international assassin’s guild, the High Table, John Wick is excommunicado, but the world’s most ruthless hit men and women await his every turn. Action Thriller Crime KeanuReeves HalleBerry IanMcShane LaurenceFishburne MarkDacascos ChadStahelski"
522518,A Dog's Journey,A dog finds the meaning of his own existence through the lives of the humans he meets. Family Adventure Drama MargHelgenberger BettyGilpin HenryLau KathrynPrescott DennisQuaid GailMancuso
508791,The Sun Is Also a Star,"Two young New Yorkers begin to fall in love over the course of a single day, as a series of potentially life-altering meetings loom over their heads - hers concerning her family’s deportation to Jamaica, and his concerning an education at Dartmouth. Romance Drama YaraShahidi CharlesMelton HillHarper GbengaAkinnagbe JakeChoi RyRusso-Young"
411728,The Professor and the Madman,"Professor James Murray begins work compiling words for the first edition of the Oxford English Dictionary in the mid 19th century, and receives over 10,000 entries from a patient at Broadmoor Criminal Lunatic Asylum, Dr. William Minor. History Drama Mystery Thriller MelGibson SeanPenn EddieMarsan NatalieDormer IoanGruffudd FarhadSafinia"
473019,The Souvenir,"A shy but ambitious film student falls into an intense, emotionally fraught relationship with a charismatic but untrustworthy older man. Romance Drama HonorSwintonByrne TomBurke TildaSwinton RichardAyoade ArianeLabed JoannaHogg"
565391,The Tomorrow Man,"Ed Hemsler spends his life preparing for a disaster that may never come. Ronnie Meisner spends her life shopping for things she may never use. In a small town somewhere in America, these two people will try to find love while trying not to get lost in each other’s stuff. Drama Romance JohnLithgow BlytheDanner DerekCecil KatieAselton SophieThatcher NobleJones"
420817,Aladdin,A kindhearted street urchin named Aladdin embarks on a magical adventure after finding a lamp that releases a wisecracking genie while a power-hungry Grand Vizier vies for the same lamp that has the power to make their deepest wishes come true. Adventure Fantasy Romance Family WillSmith MenaMassoud NaomiScott MarwanKenzari NavidNegahban GuyRitchie
531309,Brightburn,"What if a child from another world crash-landed on Earth, but instead of becoming a hero to mankind, he proved to be something far more sinister? Horror Science Fiction Thriller Mystery JacksonA.Dunn ElizabethBanks DavidDenman MattJones MeredithHagner DavidYarovesky"
505600,Booksmart,"Two academic teenage superstars realize, on the eve of their high school graduation, that they should have worked less and played more. Determined to never fall short of their peers, the girls set out on a mission to cram four years of fun into one night. Comedy BeanieFeldstein KaitlynDever JessicaWilliams JasonSudeikis LisaKudrow OliviaWilde"
698438,Swapping: Perfect Neighbor,"Couple Jin-goo and Joo-hee have been experiencing a lover's slump after their marriage. Meanwhile, a new couple in the neighborhood, Hyun-jin and Yoo-jeong came to the other couple's house to introduce themselves. They're attracted with each other's husbands and wives, and in the end, crosses the line that is not supposed to be crossed within neighbors. After that day, two couples' passion intensifies... Romance YooJung LeeEun-mi HaeIl JoWan-jin KimBu-gon"
513576,Always Be My Maybe,"Reunited after 15 years, famous chef Sasha and hometown musician Marcus feel the old sparks of attraction but struggle to adapt to each other's worlds. Romance Comedy AliWong RandallPark KeanuReeves JamesSaito MichelleButeau NahnatchkaKhan"
373571,Godzilla: King of the Monsters,"Follows the heroic efforts of the crypto-zoological agency Monarch as its members face off against a battery of god-sized monsters, including the mighty Godzilla, who collides with Mothra, Rodan, and his ultimate nemesis, the three-headed King Ghidorah. When these ancient super-species, thought to be mere myths, rise again, they all vie for supremacy, leaving humanity's very existence hanging in the balance. Science Fiction Action KyleChandler VeraFarmiga MillieBobbyBrown KenWatanabe ZhangZiyi MichaelDougherty"
504608,Rocketman,"The story of Elton John's life, from his years as a prodigy at the Royal Academy of Music through his influential and enduring musical partnership with Bernie Taupin. Music Drama TaronEgerton JamieBell RichardMadden BryceDallasHoward GemmaJones DexterFletcher"
502416,Ma,"Sue Ann is a loner who keeps to herself in her quiet Ohio town. One day, she is asked by Maggie, a new teenager in town, to buy some booze for her and her friends, and Sue Ann sees the chance to make some unsuspecting, if younger, friends of her own. Horror Thriller OctaviaSpencer DianaSilvers JulietteLewis CoreyFogelmanis McKaleyMiller TateTaylor"
320288,Dark Phoenix,"The X-Men face their most formidable and powerful foe when one of their own, Jean Grey, starts to spiral out of control. During a rescue mission in outer space, Jean is nearly killed when she's hit by a mysterious cosmic force. Once she returns home, this force not only makes her infinitely more powerful, but far more unstable. The X-Men must now band together to save her soul and battle aliens that want to use Grey's new abilities to rule the galaxy. Fantasy Science Fiction Action Adventure SophieTurner JamesMcAvoy NicholasHoult TyeSheridan MichaelFassbender SimonKinberg"
412117,The Secret Life of Pets 2,"Max the terrier must cope with some major life changes when his owner gets married and has a baby. When the family takes a trip to the countryside, nervous Max has numerous run-ins with canine-intolerant cows, hostile foxes and a scary turkey. Luckily for Max, he soon catches a break when he meets Rooster, a gruff farm dog who tries to cure the lovable pooch of his neuroses. Adventure Animation Comedy Family PattonOswalt KevinHart EricStonestreet JennySlate TiffanyHaddish ChrisRenaud"
523172,Late Night,"A legendary late-night talk show host's world is turned upside down when she hires her only female staff writer. Originally intended to smooth over diversity concerns, her decision has unexpectedly hilarious consequences as the two women separated by culture and generation are united by their love of a biting punchline. Comedy Drama EmmaThompson MindyKaling MaxCasella HughDancy JohnLithgow NishaGanatra"
522039,The Last Black Man in San Francisco,"Jimmie Fails dreams of reclaiming the Victorian home his grandfather built in the heart of San Francisco. Joined on his quest by his best friend Mont, Jimmie searches for belonging in a rapidly changing city that seems to have left them behind. Drama JimmieFails JonathanMajors TichinaArnold RobMorgan MikeEpps JoeTalbot"
575381,Changeland,"Follow two estranged best friends on an epic, life-changing adventure in Thailand as they're reminded that there's no problem that friendship and a few rounds in a Muay Thai boxing ring can't fix. Comedy Drama SethGreen BreckinMeyer BrendaSong ClareGrant KedarWilliams-Stirling SethGreen"
479455,Men in Black: International,"The Men in Black have always protected the Earth from the scum of the universe. In this new adventure, they tackle their biggest, most global threat to date: a mole in the Men in Black organization. Comedy Science Fiction Action ChrisHemsworth TessaThompson RebeccaFerguson KumailNanjiani RafeSpall F.GaryGray"
486131,Shaft,"JJ, aka John Shaft Jr., may be a cyber security expert with a degree from MIT, but to uncover the truth behind his best friend’s untimely death, he needs an education only his dad can provide. Absent throughout JJ’s youth, the legendary locked-and-loaded John Shaft agrees to help his progeny navigate Harlem’s heroin-infested underbelly. Action Crime SamuelL.Jackson JessieT.Usher ReginaHall AlexandraShipp RichardRoundtree TimStory"
535581,The Dead Don't Die,"In a small peaceful town, zombies suddenly rise to terrorize the town. Now three bespectacled police officers and a strange Scottish morgue expert must band together to defeat the undead. Comedy Horror Fantasy BillMurray AdamDriver TildaSwinton TomWaits ChloëSevigny JimJarmusch"
514999,Murder Mystery,"On a long-awaited trip to Europe, a New York City cop and his hairdresser wife scramble to solve a baffling murder aboard a billionaire's yacht. Action Comedy Mystery AdamSandler JenniferAniston LukeEvans TerenceStamp GemmaArterton KyleNewacheck"
508101,Plus One,Two single friends agree to be each others' respective plus one for each wedding they're invited to during a particularly busy nuptial period of their lives. Romance Comedy Drama MayaErskine JackQuaid BeckBennett RosalindChao PerreyReeves JeffChan
502149,Being Frank,A seventeen-year-old boy blackmails his father after discovering his secret second family Comedy JimGaffigan LoganMiller AnnaGunn SamanthaMathis AlexKarpovsky MirandaBailey
301528,Toy Story 4,"Woody has always been confident about his place in the world and that his priority is taking care of his kid, whether that's Andy or Bonnie. But when Bonnie adds a reluctant new toy called ""Forky"" to her room, a road trip adventure alongside old and new friends will show Woody how big the world can be for a toy. Family Adventure Animation Comedy Fantasy TomHanks TimAllen AnniePotts TonyHale Keegan-MichaelKey JoshCooley"
484641,Anna,Beneath Anna Poliatova's striking beauty lies a secret that will unleash her indelible strength and skill to become one of the world's most feared government assassins. Thriller Action SashaLuss HelenMirren LukeEvans CillianMurphy LeraAbova LucBesson
533642,Child's Play,"Karen, a single mother, gifts her son Andy a Buddi doll for his birthday, unaware of its more sinister nature. A contemporary re-imagining of the 1988 horror classic. Horror Thriller Science Fiction AubreyPlaza GabrielBateman BrianTyreeHenry MarkHamill TimMatheson LarsKlevberg"
521029,Annabelle Comes Home,"Determined to keep Annabelle from wreaking more havoc, demonologists Ed and Lorraine Warren bring the possessed doll to the locked artifacts room in their home, placing her “safely” behind sacred glass and enlisting a priest’s holy blessing. But an unholy night of horror awaits as Annabelle awakens the evil spirits in the room, who all set their sights on a new target—the Warrens' ten-year-old daughter, Judy, and her friends. Horror Mystery Thriller VeraFarmiga PatrickWilson MckennaGrace MadisonIseman KatieSarife GaryDauberman"
515195,Yesterday,"Jack Malik is a struggling singer-songwriter in an English seaside town whose dreams of fame are rapidly fading, despite the fierce devotion and support of his childhood best friend, Ellie. After a freak bus accident during a mysterious global blackout, Jack wakes up to discover that he's the only person on Earth who can remember The Beatles. Comedy Fantasy Music Romance HimeshPatel LilyJames SophiaDiMartino ElliseChappell MeeraSyal DannyBoyle"
428836,Ophelia,"Ophelia comes of age as lady-in-waiting for Queen Gertrude, and her singular spirit captures Hamlet's affections. As lust and betrayal threaten the kingdom, Ophelia finds herself trapped between true love and controlling her own destiny. Drama Romance History DaisyRidley NaomiWatts CliveOwen GeorgeMacKay TomFelton ClaireMcCarthy"
535265,Killers Anonymous,A failed attempt to murder a Senator is connected to a group meeting secretly to discuss their darkest urges—to take lives. Action Thriller Crime Mystery TommyFlanagan JessicaAlba GaryOldman RhyonNicoleBrown MyAnnaBuring MartinOwen
429617,Spider-Man: Far From Home,"Peter Parker and his friends go on a summer trip to Europe. However, they will hardly be able to rest - Peter will have to agree to help Nick Fury uncover the mystery of creatures that cause natural disasters and destruction throughout the continent. Action Adventure Science Fiction TomHolland SamuelL.Jackson JakeGyllenhaal MarisaTomei JonFavreau JonWatts"
480042,Escape Plan: The Extractors,"After security expert Ray Breslin is hired to rescue the kidnapped daughter of a Hong Kong tech mogul from a formidable Latvian prison, Breslin's girlfriend is also captured. Now he and his team must pull off a deadly rescue mission to confront their sadistic foe and save the hostages before time runs out. Action Adventure Crime Thriller SylvesterStallone DaveBautista 50Cent ZhangJin HarryShumJr. JohnHerzfeld"
530385,Midsommar,"Several friends travel to Sweden to study as anthropologists a summer festival that is held every ninety years in the remote hometown of one of them. What begins as a dream vacation in a place where the sun never sets, gradually turns into a dark nightmare as the mysterious inhabitants invite them to participate in their disturbing festive activities. Horror Drama Mystery FlorencePugh JackReynor WilliamJacksonHarper WillPoulter VilhelmBlomgren AriAster"
513045,Stuber,"After crashing his car, a cop who's recovering from eye surgery recruits an Uber driver to help him catch a heroin dealer. The mismatched pair soon find themselves in for a wild day of stakeouts and shootouts as they encounter the city's seedy side. Action Comedy DaveBautista KumailNanjiani MiraSorvino NatalieMorales IkoUwais MichaelDowse"
511987,Crawl,"When a huge hurricane hits her hometown in Florida, Haley ignores evacuation orders to look for her father. After finding him badly wounded, both are trapped by the flood. With virtually no time to escape the storm, they discover that rising water levels are the least of their problems. Thriller Horror Action KayaScodelario BarryPepper MorfyddClark RossAnderson JosePalma AlexandreAja"
531503,Point Blank,A nurse is forced to spring a wounded murder suspect from the hospital when the man’s brother kidnaps his pregnant wife and wants to make a trade. Action Thriller AnthonyMackie FrankGrillo MarciaGayHarden TeyonahParris BorisMcGiver JoeLynch
565310,The Farewell,A headstrong Chinese-American woman returns to China when her beloved grandmother is given a terminal diagnosis. Billi struggles with her family's decision to keep grandma in the dark about her own illness as they all stage an impromptu wedding to see grandma one last time. Comedy Drama Awkwafina ZhaoShuzhen TziMa DianaLin HongLu LuluWang
529149,Darlin',"Found at a Catholic hospital filthy and ferocious, feral teenager Darlin’ is whisked off to a care home run by The Bishop and his obedient nuns, where she’s to be rehabilitated into a ""good girl"" as an example of the miraculous work of the church. But Darlin’ holds a secret darker than the ""sins"" she is threatened with, and she is not traveling alone. The Woman who raised her, equally fierce and feral, is ever present in the shadows of Darlin’s psyche and is determined to come for her no matter who tries to get in her way. Horror Thriller Mystery LaurynCanny BryanBatt Nora-JaneNoone CooperAndrews PollyannaMcIntosh PollyannaMcIntosh"
420818,The Lion King,"Simba idolizes his father, King Mufasa, and takes to heart his own royal destiny. But not everyone in the kingdom celebrates the new cub's arrival. Scar, Mufasa's brother—and former heir to the throne—has plans of his own. The battle for Pride Rock is ravaged with betrayal, tragedy and drama, ultimately resulting in Simba's exile. With help from a curious pair of newfound friends, Simba will have to figure out how to grow up and take back what is rightfully his. Adventure Drama Family Animation ChiwetelEjiofor JohnOliver JamesEarlJones JohnKani AlfreWoodard JonFavreau"
466272,Once Upon a Time… in Hollywood,"Los Angeles, 1969. TV star Rick Dalton, a struggling actor specializing in westerns, and stuntman Cliff Booth, his best friend, try to survive in a constantly changing movie industry. Dalton is the neighbor of the young and promising actress and model Sharon Tate, who has just married the prestigious Polish director Roman Polanski… Comedy Drama Thriller LeonardoDiCaprio BradPitt MargotRobbie EmileHirsch MargaretQualley QuentinTarantino"
542417,Skin,"A destitute young man, raised by racist skinheads and notorious among white supremacists, turns his back on hatred and violence to transform his life, with the help of a black activist and the woman he loves. Drama JamieBell DanielleMacdonald VeraFarmiga BillCamp LouisaKrause GuyNattiv"
465003,The Red Sea Diving Resort,"Sudan, East Africa, 1980. A team of Israeli Mossad agents plans to rescue and transfer thousands of Ethiopian Jews to Israel. To do so, and to avoid raising suspicions from the inquisitive and ruthless authorities, they establish as a cover a fake diving resort by the Red Sea. Drama Thriller History ChrisEvans HaleyBennett AlessandroNivola MichaelKennethWilliams MichielHuisman GideonRaff"
384018,Fast & Furious Presents: Hobbs & Shaw,"Ever since US Diplomatic Security Service Agent Hobbs and lawless outcast Shaw first faced off, they just have traded smack talk and body blows. But when cyber-genetically enhanced anarchist Brixton's ruthless actions threaten the future of humanity, they join forces to defeat him. Action Adventure Comedy DwayneJohnson JasonStatham IdrisElba VanessaKirby HelenMirren DavidLeitch"
500922,A Score to Settle,A former mob enforcer who is released from prison after serving 22 years for a crime he didn't commit sets out on a path for revenge against the people who wronged him. Action Crime Drama Thriller NicolasCage NoahLeGros KarolinaWydra BenjaminBratt MohamedKarim ShawnKu
574207,The Operative,A young Western woman is recruited by the Mossad to go undercover in Tehran where she becomes entangled in a complex triangle with her handler and her subject. Drama Thriller DianeKruger MartinFreeman CasAnvar WernerDaehn LironLevo YuvalAdler
499701,Dora and the Lost City of Gold,"Dora, a girl who has spent most of her life exploring the jungle with her parents, now must navigate her most dangerous adventure yet: high school. Always the explorer, Dora quickly finds herself leading Boots (her best friend, a monkey), Diego, and a rag tag group of teens on an adventure to save her parents and solve the impossible mystery behind a lost Inca civilization. Adventure Comedy Family Fantasy IsabelaMerced JeffreyWahlberg MadeleineMadden EugenioDerbez MichaelPeña JamesBobin"
487680,The Kitchen,"The mobster husbands of three 1978 Hell's Kitchen housewives are sent to prison by the FBI. Left with little but a sharp ax to grind, the ladies take the Irish mafia's matters into their own hands — proving unexpectedly adept at everything from running the rackets to taking out the competition… literally. Action Crime Drama MelissaMcCarthy TiffanyHaddish ElisabethMoss DomhnallGleeson BillCamp AndreaBerloff"
522924,The Art of Racing in the Rain,"A family dog – with a near-human soul and a philosopher's mind – evaluates his life through the lessons learned by his human owner, a race-car driver. Drama Romance MiloVentimiglia KevinCostner AmandaSeyfried MartinDonovan IanLake SimonCurtis"
417384,Scary Stories to Tell in the Dark,"Mill Valley, Pennsylvania, Halloween night, 1968. After playing a joke on a school bully, Stella and her friends decide to sneak into a supposedly haunted house that once belonged to the powerful Bellows family, unleashing dark forces that they will be unable to control. Horror Thriller ZoeColletti DeanNorris MichaelGarza GabrielRush GilBellows AndréØvredal"
463257,The Peanut Butter Falcon,A down-on-his-luck crab fisherman embarks on a journey to get a young man with Down syndrome to a professional wrestling school in rural North Carolina and away from the retirement home where he’s lived for the past two and a half years. Adventure Comedy Drama ShiaLaBeouf ZackGottsagen DakotaJohnson ThomasHadenChurch JohnHawkes TylerNilson
527385,After the Wedding,"Seeking funds for her orphanage in India, Isabelle travels to New York to meet Theresa, a wealthy benefactor. An invitation to attend a wedding ignites a series of events in which the past collides with the present while mysteries unravel. Drama JulianneMoore MichelleWilliams BillyCrudup AbbyQuinn AlexEsola BartFreundlich"
441183,Light of My Life,"Parent and child journey through the outskirts of society a decade after a pandemic has wiped out half the world's population. As a father struggles to protect his child, their bond—and the character of humanity—is tested. Science Fiction Drama CaseyAffleck AnnaPniowsky ElisabethMoss TomBower TimothyWebber CaseyAffleck"
454640,The Angry Birds Movie 2,"Red, Chuck, Bomb and the rest of their feathered friends are surprised when a green pig suggests that they put aside their differences and unite to fight a common threat. Aggressive birds from an island covered in ice are planning to use an elaborate weapon to destroy the fowl and swine. Animation Comedy Adventure Family JasonSudeikis JoshGad DannyMcBride LeslieJones BillHader ThuropVanOrman"
521777,Good Boys,A group of young boys on the cusp of becoming teenagers embark on an epic quest to fix their broken drone before their parents get home. Comedy JacobTremblay BradyNoon KeithL.Williams MollyGordon MidoriFrancis GeneStupnitsky
534259,Blinded by the Light,"In 1987, during the austere days of Thatcher’s Britain, a teenager learns to live life, understand his family, and find his own voice through the music of Bruce Springsteen. Drama Comedy ViveikKalra NellWilliams HayleyAtwell KulvinderGhir AaronPhagura GurinderChadha"
405177,"Where'd You Go, Bernadette","When architect-turned-recluse Bernadette Fox goes missing prior to a family trip to Antarctica, her 15-year-old daughter Bee goes on a quest with Bernadette's husband to find her. Drama Comedy Adventure CateBlanchett BillyCrudup EmmaNelson KristenWiig PatrickSebes RichardLinklater"
480105,47 Meters Down: Uncaged,"Four teenage girls go on a diving adventure to explore a submerged Mayan city. Once inside, their rush of excitement turns into a jolt of terror as they discover the sunken ruins are a hunting ground for deadly great white sharks. With their air supply steadily dwindling, the friends must navigate the underwater labyrinth of claustrophobic caves and eerie tunnels in search of a way out of their watery hell. Horror Drama Adventure SophieNélisse CorinneFoxx BrianneTju SistineRoseStallone BrecBassinger JohannesRoberts"
525999,Merely Marvelous: The Dancing Genius of Gwen Verdon,"Merely Marvelous is a celebration of the art and life of Broadway's greatest dancing star, Gwen Verdon. She overcame many obstacles, including rickets, the Hollywood system, a loveless first marriage and a difficult second marriage to choreographer/director Bob Fosse, to become a multi-Tony Award-winning performer. Gwen's life is told through interviews with family members and theatre associates as well as a mine of rare footage from her Broadway and Hollywood careers. Merely Marvelous is the story of a brave woman who rose to the very top of her profession. Documentary GwenVerdon BobFosse NicoleFosse JimHenaganJr. ChitaRivera KenBloom"
