movie_id,title,tags
567609,Ready or Not,A bride's wedding night takes a sinister turn when her eccentric new in-laws force her to take part in a terrifying game. Comedy Horror Thriller SamaraWeaving AdamBrody MarkO'Brien HenryCzerny AndieMacDowell MattBettinelli-Olpin
423204,Angel Has Fallen,"After a treacherous attack, Secret Service agent Mike Banning is charged with attempting to assassinate President Trumbull. Chased by his own colleagues and the FBI, Banning begins a race against the clock to clear his name. Action Thriller GerardButler MorganFreeman JadaPinkettSmith NickNolte DannyHuston RicRomanWaugh"
529862,Brittany Runs a Marathon,A young woman decides to make positive changes in her life by training for the New York City Marathon. Comedy Drama JillianBell MichaelaWatkins UtkarshAmbudkar LilRelHowery MicahStock PaulDownsColaizzo
527776,Overcomer,"After reluctantly agreeing to coach cross-country, high school basketball Coach John Harrison helps the least likely runner attempt the impossible in the biggest race of the year. Drama AlexKendrick PriscillaC.Shirer CameronArnett ShariRigby ArynWright-Thompson AlexKendrick"
456529,Jacob's Ladder,"After losing his brother in combat, Jacob Singer returns home from Afghanistan -- only to be pulled into a mind-twisting state of paranoia. Singer soon realizes that his sibling is alive but life is not what it seems. Horror Mystery Thriller MichaelEaly JesseWilliams NicoleBeharie GuyBurnet KarlaSouza DavidM.Rosenthal"
508138,Burn,"Lonely, unstable gas station attendant Melinda is tired of being overshadowed by her more confident, outgoing co-worker Sheila. When the gas station is held up at gunpoint by Billy, a desperate man in need of quick cash, Melinda finds an opportunity to make a connection with the robber, regardless of who gets hurt. Thriller Crime Action TildaCobham-Hervey JoshHutcherson SukiWaterhouse ShilohFernandez HarryShumJr. MikeGan"
393624,Official Secrets,The true story of British intelligence whistleblower Katharine Gun who—prior to the 2003 Iraq invasion—leaked a top-secret NSA memo exposing a joint US-UK illegal spying operation against members of the UN Security Council. The memo proposed blackmailing member states into voting for war. Thriller History Drama KeiraKnightley MattSmith RalphFiennes AdamBakri MatthewGoode GavinHood
539651,Don't Let Go,"A detective suffering from a personal loss receives a call from his recently deceased niece. Being able to communicate across time, the two work together to try and stop the crime before it occurs. Science Fiction Thriller Mystery Crime DavidOyelowo StormReid MykeltiWilliamson AlfredMolina BrianTyreeHenry JacobAaronEstes"
513208,Itsy Bitsy,A family moves into a secluded mansion where they soon find themselves being targeted by an entity taking the form of a giant spider. Horror Thriller BruceDavison DeniseCrosby ElizabethRoberts ArmanDarbo ChloePerrin MicahGallo
509853,The Fanatic,A rabid film fan stalks his favorite action hero and destroys the star's life. Crime Thriller JohnTravolta DevonSawa AnaGolja JamesPaxton JessicaUberuaga FredDurst
620753,"Debunkers, Inc.",High school detectives start a business to solve murder mysteries. Family JoshPinkowski IzzyPollak BlakeKevinDwyer NicoleDuBois RyanAndrews MatthewThompson
474350,It Chapter Two,"27 years after overcoming the malevolent supernatural entity Pennywise, the former members of the Losers' Club, who have grown up and moved away from Derry, are brought back together by a devastating phone call. Horror Fantasy JamesMcAvoy JessicaChastain IsaiahMustafa BillHader JayRyan AndyMuschietti"
539364,Satanic Panic,A pizza delivery girl is suddenly in for the fight of her young life when encountering a group of Satanists in need of a virgin to ritually sacrifice. Horror Comedy HayleyGriffith RebeccaRomijn ArdenMyrin RubyModine AJBowen ChelseaStardust
470897,Strange but True,A woman surprises the family of her deceased boyfriend by telling them she's pregnant with his child. Thriller AmyRyan MargaretQualley NickRobinson BlytheDanner BrianCox RowanAthale
621742,The Obituary of Tunde Johnson,"A wealthy, Nigerian-American teenager is pulled over by police, shot to death, and immediately awakens, trapped in a terrifying time loop that forces him to confront difficult truths about his life and himself. Drama Thriller StevenSilver SpencerNeville NicolaPeltzBeckham DavidJamesElliott JoeyPollari AliLeRoi"
472674,The Goldfinch,"A boy in New York is taken in by a wealthy family after his mother is killed in a bombing at the Metropolitan Museum of Art. In a rush of panic, he steals 'The Goldfinch', a painting that eventually draws him into a world of crime. Drama AnselElgort OakesFegley NicoleKidman JeffreyWright LukeWilson JohnCrowley"
540901,Hustlers,A crew of savvy former strip club employees band together to turn the tables on their Wall Street clients. Drama Comedy Crime ConstanceWu JenniferLopez JuliaStiles KekePalmer LiliReinhart LoreneScafaria
565341,The Sound of Silence,"A successful ""house tuner"" in New York City, who calibrates the sound in people's homes in order to adjust their moods, meets a client with a problem he can't solve. Drama PeterSarsgaard RashidaJones TonyRevolori AustinPendleton KateLynSheil MichaelTyburski"
417466,Monos,"On a faraway mountaintop, eight kids with guns watch over a hostage and a conscripted milk cow. Drama Adventure MoisésArias JulianneNicholson SofiaBuenaventura KarenQuintero JulianGiraldo AlejandroLandes"
625450,Tall Girl,"Jodi, the tallest girl in her high school, has always felt uncomfortable in her own skin. But after years of slouching, being made fun of, and avoiding attention at all costs, Jodi finally decides to find the confidence to stand tall. Comedy Drama Romance AvaMichelle SabrinaCarpenter SteveZahn GriffinGluck ClaraWilsey NzinghaStewart"
419704,Ad Astra,"The near future, a time when both hope and hardships drive humanity to look to the stars and beyond. While a mysterious phenomenon menaces to destroy life on planet Earth, astronaut Roy McBride undertakes a mission across the immensity of space and its many perils to uncover the truth about a lost expedition that decades before boldly faced emptiness and silence in search of the unknown. Science Fiction Drama BradPitt TommyLeeJones RuthNegga JohnOrtiz LivTyler JamesGray"
535544,Downton Abbey,"The beloved Crawleys and their intrepid staff prepare for the most important moment of their lives. A royal visit from the King and Queen of England will unleash scandal, romance and intrigue that will leave the future of Downton hanging in the balance. Drama Romance History HughBonneville LauraCarmichael JimCarter RaquelCassidy BrendanCoyle MichaelEngler"
522938,Rambo: Last Blood,"After fighting his demons for decades, John Rambo now lives in peace on his family ranch in Arizona, but his rest is interrupted when Gabriela, the granddaughter of his housekeeper María, disappears after crossing the border into Mexico to meet her biological father. Rambo, who has become a true father figure for Gabriela over the years, undertakes a desperate and dangerous journey to find her. Action Thriller Drama SylvesterStallone PazVega SergioPeris-Mencheta AdrianaBarraza YvetteMonreal AdrianGrünberg"
543917,Bloodline,"Evan values family above all else, and anyone who gets between him, his wife, and newborn son learns that the hard way. But when it comes to violent tendencies, it seems the apple doesn’t fall far from the tree. Thriller Crime Horror SeannWilliamScott MarielaGarriga DaleDickey ChristieHerring LarsenThompson HenryJacobson"
523077,Running with the Devil,A leader of a drug cartel sends his two toughest henchmen to investigate why a shipment was botched. Crime Drama Thriller NicolasCage LeslieBibb PeterFacinelli ColeHauser LaurenceFishburne JasonCabell
568091,Fractured,"Driving cross-country, Ray and his wife and daughter stop at a highway rest area where his daughter falls and breaks her arm. After a frantic rush to the hospital and a clash with the check-in nurse, Ray is finally able to get her to a doctor. While the wife and daughter go downstairs for an MRI, Ray, exhausted, passes out in a chair in the lobby. Upon waking up, they have no record or knowledge of Ray's family ever being checked in. Thriller SamWorthington LilyRabe StephenTobolowsky AdjoaAndoh LaurenCochrane BradAnderson"
431580,Abominable,"A group of misfits encounter a young Yeti named Everest, and they set off to reunite the magical creature with his family on the mountain of his namesake. Family Animation Adventure Comedy ChloeBennet AlbertTsai TenzingNorgayTrainor JosephIzzo EddieIzzard JillCulton"
517909,The Laundromat,"When her idyllic vacation takes an unthinkable turn, Ellen Martin begins investigating a fake insurance policy, only to find herself down a rabbit hole of questionable dealings that can be linked to a Panama City law firm and its vested interest in helping the world's wealthiest citizens amass larger fortunes. Drama Crime Comedy MerylStreep GaryOldman AntonioBanderas JeffreyWright MelissaRauch StevenSoderbergh"
491283,Judy,"Thirty years after starring in ""The Wizard of Oz,"" beloved actress and singer Judy Garland arrives in London to perform sold-out shows at the Talk of the Town nightclub. While there, she reminisces with friends and fans and begins a whirlwind romance with musician Mickey Deans, her soon-to-be fifth husband. Drama History Music RenéeZellweger JessieBuckley FinnWittrock RufusSewell MichaelGambon RupertGoold"
401410,Prey,"After being put on a supposedly uninhabited island as a form of behavioral rehabilitation, a high school senior finds that he's not alone on the island, and that getting discovered could be deadly. Horror Thriller Adventure LoganMiller KristineFroseth JoleneAnderson PhodisoDintwe JerricaLai FranckKhalfoun"
552865,10 Minutes Gone,"Crime boss Rex hires Frank and his crew to steal a priceless jewel stash — but the job goes wrong when someone tips off the cops. After Frank suffers a blow to the head, he wakes up to find the jewels gone and no memory of his attacker. Now, Frank must confront his team members one by one to find the traitor — before Rex covers his tracks by having Frank murdered. Crime Action Thriller Mystery MichaelChiklis BruceWillis MeadowWilliams KyleSchmid TexasBattle BrianA.Miller"
475557,Joker,"During the 1980s, a failed stand-up comedian is driven insane and turns to a life of crime and chaos in Gotham City while becoming an infamous psychopathic crime figure. Crime Thriller Drama JoaquinPhoenix RobertDeNiro ZazieBeetz FrancesConroy BrettCullen ToddPhillips"
340104,Lucy in the Sky,Astronaut Lucy Cola returns to Earth after a transcendent experience during a mission to space – and begins to lose touch with reality in a world that now seems too small. Drama Thriller Romance NataliePortman JonHamm ZazieBeetz DanStevens EllenBurstyn NoahHawley
528888,Dolemite Is My Name,"The story of Rudy Ray Moore, who created the iconic big screen pimp character Dolemite in the 1970s. Drama Comedy History EddieMurphy WesleySnipes Da'VineJoyRandolph Keegan-MichaelKey MikeEpps CraigBrewer"
523139,In the Tall Grass,"After hearing a child screaming for help from the green depths of a vast field of tall grass, Becky, a pregnant woman, and Cal, her brother, park their car near a mysterious abandoned church and enter the field, discovering that they are not alone and, for some reason, they are unable to escape a completely inextricable vegetable labyrinth. Horror Drama Thriller LayslaDeOliveira HarrisonGilbertson AveryWhitted WillBuieJr. PatrickWilson VincenzoNatali"
493066,Low Tide,"In the long days of summer in a beach town on the New Jersey shore, high schooler Alan and his friends Red and Smitty break into vacation homes to steal valuables, funding dates at the boardwalk and lunches at the burger stand. When Alan and his younger brother Peter find a bag of gold coins, they try to hide them from the others — but Red, suspicious and violently unpredictable, seems willing to do anything to get the money. Thriller JaedenMartell KeeanJohnson SheaWhigham AlexNeustaedter DanielZolghadri KevinMcMullin"
619262,Wrinkles the Clown,"In Florida, parents can hire Wrinkles the Clown to scare their misbehaving children. Documentary MichaelBeachNichols"
503125,Little Monsters,A washed-up musician teams up with a teacher and a kids show personality to protect young children from a sudden outbreak of zombies. Horror Comedy LupitaNyong'o AlexanderEngland JoshGad DieselLaTorraca KatStewart AbeForsythe
453405,Gemini Man,"Henry Brogan is an elite 51-year-old assassin who's ready to call it quits after completing his 72nd job. His plans get turned upside down when he becomes the target of a mysterious operative who can seemingly predict his every move. To his horror, Brogan soon learns that the man who's trying to kill him is a younger, faster, cloned version of himself. Science Fiction Action Thriller WillSmith MaryElizabethWinstead CliveOwen BenedictWong DouglasHodge AngLee"
481084,The Addams Family,"The Addams family's lives begin to unravel when they face-off against a treacherous, greedy crafty reality-TV host while also preparing for their extended family to arrive for a major celebration. Family Animation Comedy Fantasy OscarIsaac CharlizeTheron ChloëGraceMoretz FinnWolfhard NickKroll ConradVernon"
504949,The King,"England, 15th century. Hal, a capricious prince who lives among the populace far from court, is forced by circumstances to reluctantly accept the throne and become Henry V. Drama History War TimothéeChalamet JoelEdgerton SeanHarris TomGlynn-Carney Lily-RoseDepp DavidMichôd"
620725,Jexi,"Phil's new phone comes with an unexpected feature, Jexi...an A.I. determined to keep him all to herself in a comedy about what can happen when you love your phone more than all else. Comedy AdamDevine AlexandraShipp RoseByrne RonFunches CharlyneYi JonLucas"
431075,Polaroid,"High school loner Bird Fitcher has no idea what dark secrets are tied to the mysterious Polaroid vintage camera she stumbles upon, but it doesn't take long to discover that those who have their picture taken meet a tragic end. Bird and her friends must survive one more night as they race to solve the mystery of the haunted Polaroid before it kills them all. Horror Thriller Mystery KathrynPrescott TylerYoung SamanthaLogan KeenanTracey PriscillaQuintana LarsKlevberg"
559969,El Camino: A Breaking Bad Movie,"In the wake of his dramatic escape from captivity, Jesse Pinkman must come to terms with his past in order to forge some kind of future. Crime Drama Thriller AaronPaul JessePlemons CharlesBaker MattJones ScottMacArthur VinceGilligan"
420809,Maleficent: Mistress of Evil,"Maleficent and her goddaughter Aurora begin to question the complex family ties that bind them as they are pulled in different directions by impending nuptials, unexpected allies, and dark new forces at play. Family Fantasy Adventure Action AngelinaJolie ElleFanning HarrisDickinson MichellePfeiffer SamRiley JoachimRønning"
338967,Zombieland: Double Tap,"Columbus, Tallahassee, Wichita, and Little Rock move to the American heartland as they face off against evolved zombies, fellow survivors, and the growing pains of the snarky makeshift family. Comedy Horror WoodyHarrelson JesseEisenberg EmmaStone AbigailBreslin RosarioDawson RubenFleischer"
515001,Jojo Rabbit,"A World War II satire that follows a lonely German boy whose world view is turned upside down when he discovers his single mother is hiding a young Jewish girl in their attic. Aided only by his idiotic imaginary friend, Adolf Hitler, Jojo must confront his blind nationalism. Comedy War Drama RomanGriffinDavis ThomasinMcKenzie ScarlettJohansson TaikaWaititi SamRockwell TaikaWaititi"
503919,The Lighthouse,Two lighthouse keepers try to maintain their sanity while living on a remote and mysterious New England island in the 1890s. Drama Fantasy Thriller Horror RobertPattinson WillemDafoe ValeriiaKaraman LoganHawkes KylaNicolle RobertEggers
505423,Wounds,Disturbing and mysterious things begin to happen to a bartender in New Orleans after he picks up a phone left behind at his bar. Horror Mystery Thriller ArmieHammer DakotaJohnson ZazieBeetz BradWilliamHenke KarlGlusman BabakAnvari
578189,Black and Blue,"A rookie cop inadvertently captures the murder of a young drug dealer on her body cam. After realizing that the murder was committed by corrupt cops, she teams up with the one person from her community who is willing to help her as she tries to escape both the criminals out for revenge and the police who are desperate to destroy the incriminating footage. Action Crime Drama Thriller NaomieHarris TyreseGibson FrankGrillo MikeColter ReidScott DeonTaylor"
599975,Countdown,"A young nurse downloads an app that tells her she only has three days to live. With time ticking away and a mysterious figure haunting her, she must find a way to save her life before time runs out. Horror Thriller ElizabethLail JordanCalloway TalithaBateman PeterFacinelli DillonLane JustinDec"
489245,The Kill Team,"When Andrew Briggman—a young soldier in the US invasion of Afghanistan—witnesses other recruits killing innocent civilians under the direction of a sadistic Sergeant, he considers reporting them to higher-ups. However, the heavily-armed and increasingly-violent platoon becomes suspicious that someone in their ranks has turned on them, and Andrew begins to fear that he'll be the next target. War Action Drama NatWolff AlexanderSkarsgård AdamLong JonathanWhitesell BrianMarc DanKrauss"
505060,The Gallows Act II,"When Auna Rue transfers to a prestigious new acting school, she encounters a malevolent spirit after participating in a viral challenge. Horror Thriller EmaHorvath ChrisMilligan BrittanyFalardeau PfeiferBrown ErikaMiranda TravisCluff"
290859,Terminator: Dark Fate,"Decades after Sarah Connor prevented Judgment Day, a lethal new Terminator is sent to eliminate the future leader of the resistance. In a fight to save mankind, battle-hardened Sarah Connor teams up with an unexpected ally and an enhanced super soldier to stop the deadliest Terminator yet. Science Fiction Adventure Action LindaHamilton MackenzieDavis NataliaReyes ArnoldSchwarzenegger GabrielLuna TimMiller"
504562,Motherless Brooklyn,"New York City, 1957. Lionel Essrog, a private detective living with Tourette syndrome, tries to solve the murder of his mentor and best friend, armed only with vague clues and the strength of his obsessive mind. Drama Thriller EdwardNorton BruceWillis GuguMbatha-Raw AlecBaldwin WillemDafoe EdwardNorton"
398978,The Irishman,"Pennsylvania, 1956. Frank Sheeran, a war veteran of Irish origin who works as a truck driver, accidentally meets mobster Russell Bufalino. Once Frank becomes his trusted man, Bufalino sends him to Chicago with the task of helping Jimmy Hoffa, a powerful union leader related to organized crime, with whom Frank will maintain a close friendship for nearly twenty years. Crime Drama History RobertDeNiro AlPacino JoePesci StephenGraham RayRomano MartinScorsese"
506528,Harriet,"The extraordinary tale of Harriet Tubman's escape from slavery and transformation into one of America's greatest heroes. Her courage, ingenuity and tenacity freed hundreds of slaves and changed the course of history. Drama History CynthiaErivo LeslieOdomJr. JoeAlwyn ClarkePeters VanessaBellCalloway KasiLemmons"
416153,Arctic Dogs,Animals band together to save the day when the evil Otto Von Walrus hatches a sinister scheme to accelerate global warming and melt the Arctic Circle. Animation Adventure Comedy JamesFranco JeremyRenner AlecBaldwin AnjelicaHuston MichaelMadsen AaronWoodley
492188,Marriage Story,"A stage director and an actress struggle through a grueling, coast-to-coast divorce that pushes them to their personal extremes. Drama AdamDriver ScarlettJohansson LauraDern AlanAlda RayLiotta NoahBaumbach"
501170,Doctor Sleep,"Still irrevocably scarred by the trauma he endured as a child at the Overlook, Dan Torrance has fought to find some semblance of peace. But that peace is shattered when he encounters Abra, a courageous teenager with her own powerful extrasensory gift, known as the 'shine'. Instinctively recognising that Dan shares her power, Abra has sought him out, desperate for his help against the merciless Rose the Hat and her followers. Horror Thriller Fantasy EwanMcGregor KylieghCurran RebeccaFerguson CliffCurtis ZahnMcClarnon MikeFlanagan"
549053,Last Christmas,"Kate is a young woman who has a habit of making bad decisions, and her last date with disaster occurs after she accepts work as Santa's elf for a department store. However, after she meets Tom there, her life takes a new turn. Comedy Romance EmiliaClarke HenryGolding MichelleYeoh EmmaThompson LydiaLeonard PaulFeig"
554241,Playing with Fire,A crew of rugged firefighters meet their match when attempting to rescue three rambunctious kids. Family Comedy JohnCena Keegan-MichaelKey JohnLeguizamo TylerMane BriannaHildebrand AndyFickman
295151,Let It Snow,"In a small town on Christmas Eve, a snowstorm brings together a group of young people. They soon find their friendships and love lives colliding, and come Christmas morning, nothing will be the same. Romance Comedy IsabelaMerced ShameikMoore OdeyaRush LivHewson MitchellHope LukeSnellin"
522162,Midway,"The story of the Battle of Midway, and the leaders and soldiers who used their instincts, fortitude and bravery to overcome massive odds. Action Drama War History Adventure EdSkrein PatrickWilson WoodyHarrelson LukeEvans MandyMoore RolandEmmerich"
508965,Klaus,"When Jesper distinguishes himself as the Postal Academy's worst student, he is sent to Smeerensburg, a small village located on an icy island above the Arctic Circle, where grumpy inhabitants barely exchange words, let alone letters. Jesper is about to give up and abandon his duty as a postman when he meets local teacher Alva and Klaus, a mysterious carpenter who lives alone in a cabin full of handmade toys. Animation Family Adventure Comedy Fantasy JasonSchwartzman J.K.Simmons RashidaJones JoanCusack NormMacdonald SergioPablos"
512263,Honey Boy,"The story of a child star attempting to mend his relationship with his law-breaking, alcohol-abusing father over the course of a decade, loosely based on Shia LaBeouf’s life. Drama ShiaLaBeouf LucasHedges NoahJupe ByronBowers LauraSanGiacomo AlmaHar'el"
512895,Lady and the Tramp,"The love story between a pampered Cocker Spaniel named Lady and a streetwise mongrel named Tramp. Lady finds herself out on the street after her owners have a baby and is saved from a pack by Tramp, who tries to show her to live her life footloose and collar-free. Family Romance Comedy TessaThompson JustinTheroux KierseyClemons ThomasMann AshleyJensen CharlieBean"
454467,Noelle,"Kris Kringle's daughter, Noelle, sets off on a mission to find and bring back her brother, after he gets cold feet when it's his turn to take over as Santa. Family Comedy Fantasy AnnaKendrick BillHader KingsleyBen-Adir BillyEichner JulieHagerty MarcLawrence"
359724,Ford v Ferrari,"American car designer Carroll Shelby and the British-born driver Ken Miles work together to battle corporate interference, the laws of physics, and their own personal demons to build a revolutionary race car for Ford Motor Company and take on the dominating race cars of Enzo Ferrari at the 24 Hours of Le Mans in France in 1966. Drama Action History ChristianBale MattDamon JonBernthal CaitríonaBalfe JoshLucas JamesMangold"
458897,Charlie's Angels,"Elena Houghlin is a scientist, engineer and inventor of Calisto -- a sustainable energy source that will revolutionize the way people use power. It will be ready as soon as she works out the last issue, if not it could be turned into a dangerous weapon. But when the cutting edge technology is pushed to an investor before she can do that, Elena turns to the Townsend Agency for help. Now, it's up to the Angels -- Jane, Sabina, and the newly recruited Elena -- to retrieve Calisto before it can be transformed into a weapon of mass destruction. Action Adventure Comedy KristenStewart NaomiScott EllaBalinska ElizabethBanks PatrickStewart ElizabethBanks"
511322,The Good Liar,"Career con man Roy sets his sights on his latest mark: recently widowed Betty, worth millions. And he means to take it all. But as the two draw closer, what should have been another simple swindle takes on the ultimate stakes. Crime HelenMirren IanMcKellen RussellTovey JimCarter MarkLewisJones BillCondon"
524348,The Report,"The story of Daniel Jones, lead investigator for the US Senate’s sweeping study into the CIA's Detention and Interrogation Program, which was found to be brutal, immoral and ineffective. With the truth at stake, Jones battled tirelessly to make public what many in power sought to keep hidden. Thriller Drama AdamDriver AnnetteBening JonHamm SarahGoldberg MichaelC.Hall ScottZ.Burns"
533444,Waves,A controlling father’s attempts to ensure that his two children succeed in high school backfire after his son experiences a career-ending sports injury. Their familial bonds are eventually placed under severe strain by an unexpected tragedy. Romance Drama KelvinHarrisonJr. TaylorRussell RenéeEliseGoldsberry SterlingK.Brown LucasHedges TreyEdwardShults
330457,Frozen II,"Elsa, Anna, Kristoff and Olaf head far into the forest to learn the truth about an ancient mystery of their kingdom. Family Animation Adventure Comedy Fantasy IdinaMenzel KristenBell JoshGad JonathanGroff EvanRachelWood ChrisBuck"
