movie_id,title,tags
501907,A Beautiful Day in the Neighborhood,"An award-winning cynical journalist, Lloyd Vogel, begrudgingly accepts an assignment to write an Esquire profile piece on the beloved television icon Fred Rogers. After his encounter with Rogers, Vogel's perspective on life is transformed. Drama History TomHanks MatthewRhys ChrisCooper SusanKelechiWatson MaryannPlunkett MarielleHeller"
535292,21 Bridges,"An embattled NYPD detective, is thrust into a citywide manhunt for a pair of cop killers after uncovering a massive and unexpected conspiracy. As the night unfolds, lines become blurred on who he is pursuing, and who is in pursuit of him. Crime Action Drama ChadwickBoseman SiennaMiller J.K.Simmons StephanJames TaylorKitsch BrianKirk"
552178,Dark Waters,"A tenacious attorney uncovers a dark secret that connects a growing number of unexplained deaths to one of the world's largest corporations. In the process, he risks everything — his future, his family, and his own life — to expose the truth. Drama Thriller MarkRuffalo AnneHathaway TimRobbins BillPullman BillCamp ToddHaynes"
546554,Knives Out,"When renowned crime novelist Harlan Thrombey is found dead at his estate just after his 85th birthday, the inquisitive and debonair Detective Benoit Blanc is mysteriously enlisted to investigate. From Harlan's dysfunctional family to his devoted staff, Blanc sifts through a web of red herrings and self-serving lies to uncover the truth behind Harlan's untimely death. Comedy Crime Mystery DanielCraig ChrisEvans AnadeArmas JamieLeeCurtis MichaelShannon RianJohnson"
536743,Queen & Slim,"While on a forgettable first date together in Ohio, a black man and a black woman are pulled over for a minor traffic infraction. The situation escalates, with sudden and tragic results. Drama Romance Crime DanielKaluuya JodieTurner-Smith BokeemWoodbine ChloëSevigny Flea MelinaMatsoukas"
551332,The Two Popes,"Frustrated with the direction of the church, Cardinal Bergoglio requests permission to retire in 2012 from Pope Benedict. Instead, facing scandal and self-doubt, the introspective Pope Benedict summons his harshest critic and future successor to Rome to reveal a secret that would shake the foundations of the Catholic Church. Drama Comedy History JonathanPryce AnthonyHopkins JuanMinujín LuisGnecco CristinaBanegas FernandoMeirelles"
366668,Playmobil: The Movie,Marla is forced to abandon her carefully structured life to embark on an epic journey to find her younger brother Charlie who has disappeared into the vast and wondrous animated world of Playmobil toys. Family Animation Comedy Adventure AnyaTaylor-Joy JimGaffigan GabrielBateman AdamLambert KenanThompson LinoDiSalvo
514921,The Aeronauts,"In 1862, daredevil balloon pilot Amelia Wren teams up with pioneering meteorologist James Glaisher to advance human knowledge of the weather and fly higher than anyone in history. While breaking records and advancing scientific discovery, their voyage to the very edge of existence helps the unlikely pair find their place in the world they have left far below them. But they face physical and emotional challenges in the thin air, as the ascent becomes a fight for survival. Adventure Drama Romance EddieRedmayne FelicityJones TomCourtenay PhoebeFox HimeshPatel TomHarper"
499566,A Million Little Pieces,A young drug-addled writer approaching the bottom of his descent submits to two months of agonizing detox at a treatment center in Minnesota. Drama AaronTaylor-Johnson BillyBobThornton OdessaYoung GiovanniRibisi JulietteLewis SamTaylor-Johnson
537788,Daniel Isn't Real,"A troubled college freshman, Luke, suffers a violent family trauma and resurrects his childhood imaginary friend Daniel to help him cope. Horror Mystery MilesRobbins PatrickSchwarzenegger SashaLane HannahMarks MaryStuartMasterson AdamEgyptMortimer"
641790,Trauma Center,"Lt. Wakes is a vengeful police detective determined to solve the murders of his partner and an informant, and joins forces with a witness injured during the shootings. After the killers pursue the witness across the abandoned floor of a hospital, she confirms Wakes's worst fears. Action Thriller NickyWhelan BruceWillis SteveGuttenberg TitoOrtiz TexasBattle MattEskandari"
512200,Jumanji: The Next Level,"As the gang return to Jumanji to rescue one of their own, they discover that nothing is as they expect. The players will have to brave parts unknown and unexplored in order to escape the world’s most dangerous game. Adventure Comedy Fantasy DwayneJohnson KevinHart JackBlack KarenGillan Awkwafina JakeKasdan"
292011,Richard Jewell,"Richard Jewell thinks quick, works fast, and saves hundreds, perhaps thousands, of lives after a domestic terrorist plants several pipe bombs and they explode during a concert, only to be falsely suspected of the crime by sloppy FBI work and sensational media coverage. Drama Crime PaulWalterHauser JonHamm KathyBates SamRockwell OliviaWilde ClintEastwood"
551808,Black Christmas,"During Christmas break, the women at Hawthorne College start being preyed upon by an unknown stalker. Riley, a girl dealing with her own trauma, decides to take matters into her own hands before her and her friends are murdered too. Horror Mystery Thriller ImogenPoots AleyseShannon LilyDonoghue BrittanyO'Grady CalebEberhardt SophiaTakal"
509967,6 Underground,"After faking his death, a tech billionaire recruits a team of international operatives for a bold and bloody mission to take down a brutal dictator. Action Comedy Thriller RyanReynolds MélanieLaurent ManuelGarcia-Rulfo BenHardy AdriaArjona MichaelBay"
525661,Bombshell,Bombshell is a revealing look inside the most powerful and controversial media empire of all time; and the explosive story of the women who brought down the infamous man who created it. Drama CharlizeTheron NicoleKidman MargotRobbie JohnLithgow AllisonJanney JayRoach
473033,Uncut Gems,"A charismatic New York City jeweler always on the lookout for the next big score makes a series of high-stakes bets that could lead to the windfall of a lifetime. Howard must perform a precarious high-wire act, balancing business, family, and encroaching adversaries on all sides in his relentless pursuit of the ultimate win. Drama Thriller Crime AdamSandler LaKeithStanfield JuliaFox KevinGarnett IdinaMenzel JoshSafdie"
510298,Seberg,An ambitious young FBI agent is assigned to investigate iconic actress Jean Seberg when she becomes embroiled in the tumultuous civil rights movement in late 1960s Los Angeles. Thriller Drama KristenStewart JackO'Connell AnthonyMackie MargaretQualley ZazieBeetz BenedictAndrews
403300,A Hidden Life,Austrian farmer Franz Jägerstätter faces the threat of execution for refusing to fight for the Nazis during World War II. Drama War History AugustDiehl ValeriePachner MariaSimon KarinNeuhäuser TobiasMoretti TerrenceMalick
181812,Star Wars: The Rise of Skywalker,"The surviving Resistance faces the First Order once again as the journey of Rey, Finn and Poe Dameron continues. With the power and knowledge of generations behind them, the final battle begins. Adventure Action Science Fiction CarrieFisher MarkHamill DaisyRidley AdamDriver JohnBoyega J.J.Abrams"
536869,Cats,A tribe of cats called the Jellicles must decide yearly which one will ascend to the Heaviside Layer and come back to a new Jellicle life. Fantasy Comedy Drama FrancescaHayward JudiDench IdrisElba JasonDerulo JenniferHudson TomHooper
606856,Togo,"The untold true story set in the winter of 1925 that takes you across the treacherous terrain of the Alaskan tundra for an exhilarating and uplifting adventure that will test the strength, courage and determination of one man, Leonhard Seppala, and his lead sled dog, Togo. Adventure Family WillemDafoe JulianneNicholson ChristopherHeyerdahl RichardDormer AdrienDorval EricsonCore"
431693,Spies in Disguise,"Super spy Lance Sterling and scientist Walter Beckett are almost exact opposites. Lance is smooth, suave and debonair. Walter is… not. But what Walter lacks in social skills he makes up for in smarts and invention, creating the awesome gadgets Lance uses on his epic missions. But when events take an unexpected turn, Walter and Lance suddenly have to rely on each other in a whole new way. Animation Action Adventure Comedy Family WillSmith TomHolland BenMendelsohn RashidaJones KarenGillan TroyQuane"
331482,Little Women,Four sisters come of age in America in the aftermath of the Civil War. Drama Romance SaoirseRonan FlorencePugh EmmaWatson ElizaScanlen LauraDern GretaGerwig
530915,1917,"At the height of the First World War, two young British soldiers must cross enemy territory and deliver a message that will stop a deadly attack on hundreds of soldiers. War Action Drama GeorgeMacKay Dean-CharlesChapman MarkStrong AndrewScott RichardMadden SamMendes"
522212,Just Mercy,"The powerful true story of Harvard-educated lawyer Bryan Stevenson, who goes to Alabama to defend the disenfranchised and wrongly condemned — including Walter McMillian, a man sentenced to death despite evidence proving his innocence. Bryan fights tirelessly for Walter with the system stacked against them. Drama Crime History MichaelB.Jordan BrieLarson JamieFoxx O'SheaJacksonJr. RafeSpall DestinDanielCretton"
565307,Clemency,"Years of carrying out death row executions have taken a toll on prison warden Bernadine Williams. As she prepares to execute another inmate, Bernadine must confront the psychological and emotional demons her job creates, ultimately connecting her to the man she is sanctioned to kill. Drama AlfreWoodard RichardSchiff AldisHodge WendellPierce DanielleBrooks ChinonyeChukwu"
