movie_id,title,tags
522681,Escape Room,"Six strangers find themselves in circumstances beyond their control, and must use their wits to survive. Horror Thriller Mystery TaylorRussell LoganMiller JayEllis DeborahAnnWoll NikDodani AdamRobitel"
561362,Rust Creek,"When an overachieving college senior makes a wrong turn, her road trip becomes a life-changing fight for survival in rural Kentucky. Thriller Drama Action Crime HermioneCorfield JayPaulson SeanO'Bryan MicahA.Hauptman DanielR.Hill JenMcGowan"
567738,American Hangman,"An unidentified man posts a live feed on social media showing that he has kidnapped two strangers and intends to kill one before the day is out. His intention is to hold a capital 'trial' online. As the authorities recognize what's happening, it becomes apparent that the online public is going to act as judge and jury. Thriller DonaldSutherland VincentKartheiser OliverDennis PaulBraunstein MattBaram WilsonConeybeare"
508763,A Dog's Way Home,"The adventure of Bella, a dog who embarks on an epic 400-mile journey home after she is separated from her beloved human. Drama Adventure Family AshleyJudd JonahHauer-King EdwardJamesOlmos AlexandraShipp ChrisBauer CharlesMartinSmith"
440472,The Upside,"Phillip is a wealthy quadriplegic who needs a caretaker to help him with his day-to-day routine in his New York penthouse. He decides to hire Dell, a struggling parolee who's trying to reconnect with his ex and his young son. Despite coming from two different worlds, an unlikely friendship starts to blossom. Comedy Drama KevinHart BryanCranston NicoleKidman GolshiftehFarahani AjaNaomiKing NeilBurger"
414777,After Darkness,"As the Sun burns out, an American family gathers at the end of the world, their hopes for rescue slowly crumbling as they also confront long lasting divides amongst each other. Drama Family Thriller Science Fiction NataliaDyer ValorieCurry KyraSedgwick TimDaly JohnPatrickAmedori BatanSilva"
450465,Glass,"In a series of escalating encounters, former security guard David Dunn uses his supernatural abilities to track Kevin Wendell Crumb, a disturbed man who has twenty-four personalities. Meanwhile, the shadowy presence of Elijah Price emerges as an orchestrator who holds secrets critical to both men. Thriller Drama Science Fiction JamesMcAvoy BruceWillis SamuelL.Jackson AnyaTaylor-Joy SarahPaulson M.NightShyamalan"
460321,Close,"A counter-terrorism expert takes a job protecting a young heiress. After an attempted kidnapping puts both of their lives in danger, they must flee. Action Adventure Thriller NoomiRapace SophieNélisse IndiraVarma EoinMacken AkinGazi VickyJewson"
516630,The Standoff at Sparrow Creek,"After a mass shooting at a police funeral, reclusive ex-cop Gannon finds himself unwittingly forced out of retirement when he realizes that the killer belongs to the same militia he joined after quitting the force. Understanding that the shooting could set off a chain reaction of copycat violence across the country, Gannon quarantines his fellow militiamen in the remote lumber mill they call their headquarters. There, he sets about a series of grueling interrogations, intent on ferreting out the killer and turning him over to the authorities to prevent further bloodshed. Drama Thriller Mystery JamesBadgeDale BrianGeraghty PatrickFischler ChrisMulkey HappyAnderson HenryDunham"
554739,The Final Wish,"Following the passing of his father, Aaron Hammond returns to his hometown to help his devastated mother and to confront his past demons. Sifting through his father’s belongings, Aaron comes upon a mysterious item that is far more than it seems. Horror LinShaye MichaelWelch MelissaBolona SpencerLocke TonyTodd TimothyWoodwardJr."
454294,The Kid Who Would Be King,"Old-school magic meets the modern world when young Alex stumbles upon the mythical sword Excalibur. He soon unites his friends and enemies, and they become knights who join forces with the legendary wizard Merlin. Together, they must save mankind from the wicked enchantress Morgana and her army of supernatural warriors. Action Adventure Fantasy Family LouisAshbourneSerkis DeanChaumoo TomTaylor RhiannaDorris DeniseGough JoeCornish"
452832,Serenity,"The quiet life of Baker Dill, a fishing boat captain who lives on the isolated Plymouth Island, where he spends his days obsessed with capturing an elusive tuna while fighting his personal demons, is interrupted when someone from his past comes to him searching for help. Thriller Mystery Drama MatthewMcConaughey AnneHathaway JasonClarke DianeLane DjimonHounsou StevenKnight"
505948,I Am Mother,"A teenage girl is raised underground by a robot ""Mother"", designed to repopulate the earth following an extinction event. But their unique bond is threatened when an inexplicable stranger arrives with alarming news. Science Fiction Thriller ClaraRugaard RoseByrne HilarySwank LukeHawker TahliaSturzaker GrantSputore"
565743,The Vast of Night,"At the dawn of the space-race, two radio-obsessed teens discover a strange frequency over the airwaves in what becomes the most important night of their lives and in the history of their small town. Drama Mystery Science Fiction Thriller SierraMcCormick JakeHorowitz BruceDavis GailCronauer CheyenneBarton AndrewPatterson"
500852,Miss Bala,"Gloria finds a power she never knew she had when she is drawn into a dangerous world of cross-border crime. Surviving will require all of her cunning, inventiveness, and strength. Action GinaRodriguez IsmaelCruzCórdova AislinnDerbez MattLauria DamiánAlcázar CatherineHardwicke"
463684,Velvet Buzzsaw,"Big money artists and mega-collectors pay a high price when art collides with commerce. After a series of paintings by an unknown artist are discovered, a supernatural force enacts revenge on those who have allowed their greed to get in the way of art. Thriller Mystery Horror ReneRusso JakeGyllenhaal ZaweAshton TomSturridge ToniCollette DanGilroy"
280217,The Lego Movie 2: The Second Part,"It's been five years since everything was awesome and the citizens are facing a huge new threat: LEGO DUPLO® invaders from outer space, wrecking everything faster than they can rebuild. Action Adventure Animation Comedy Family ChrisPratt ElizabethBanks WillArnett TiffanyHaddish StephanieBeatriz MikeMitchell"
487297,What Men Want,"Magically able to hear what men are thinking, a sports agent uses her newfound ability to turn the tables on her overbearing male colleagues. Comedy Romance TarajiP.Henson AldisHodge JoshBrener TracyMorgan ShanePaulMcGhie AdamShankman"
438650,Cold Pursuit,"The quiet family life of Nels Coxman, a snowplow driver, is upended after his son's murder. Nels begins a vengeful hunt for Viking, the drug lord he holds responsible for the killing, eliminating Viking's associates one by one. As Nels draws closer to Viking, his actions bring even more unexpected and violent consequences, as he proves that revenge is all in the execution. Comedy Action Crime Thriller LiamNeeson TomBateman TomJackson LauraDern NicholasHolmes HansPetterMoland"
510498,High Flying Bird,"During an NBA lockout, a sports agent, Ray Burke, presents his rookie client, Erick Scott, with an intriguing and controversial business opportunity. Drama AndréHolland ZazieBeetz MelvinGregg SonjaSohn ZacharyQuinto StevenSoderbergh"
532671,The Prodigy,A mother concerned about her young son's disturbing behavior thinks something supernatural may be affecting him. Horror Thriller TaylorSchilling JacksonRobertScott ColmFeore BrittanyAllen PeterMooney NicholasMcCarthy
449563,Isn't It Romantic,"For a long time, Natalie, an Australian architect living in New York City, had always believed that what she had seen in rom-coms is all fantasy. But after thwarting a mugger at a subway station only to be knocked out while fleeing, Natalie wakes up and discovers that her life has suddenly become her worst nightmare—a romantic comedy—and she is the leading lady. Comedy Fantasy Romance RebelWilson LiamHemsworth AdamDevine PriyankaChopraJonas BettyGilpin ToddStrauss-Schulson"
512196,Happy Death Day 2U,"Collegian Tree Gelbman wakes up in horror to learn that she's stuck in a parallel universe. Her boyfriend Carter is now with someone else, and her friends and fellow students seem to be completely different versions of themselves. When Tree discovers that Carter's roommate has been altering time, she finds herself once again the target of a masked killer. When the psychopath starts to go after her inner circle, Tree soon realizes that she must die over and over again to save everyone. Comedy Horror Science Fiction JessicaRothe IsraelBroussard RubyModine SurajSharma RachelMatthews ChristopherLandon"
399579,Alita: Battle Angel,"When Alita awakens with no memory of who she is in a future world she does not recognize, she is taken in by Ido, a compassionate doctor who realizes that somewhere in this abandoned cyborg shell is the heart and soul of a young woman with an extraordinary past. Action Science Fiction Adventure RosaSalazar ChristophWaltz JenniferConnelly MahershalaAli EdSkrein RobertRodriguez"
166428,How to Train Your Dragon: The Hidden World,"As Hiccup fulfills his dream of creating a peaceful dragon utopia, Toothless’ discovery of an untamed, elusive mate draws the Night Fury away. When danger mounts at home and Hiccup’s reign as village chief is tested, both dragon and rider must make impossible decisions to save their kind. Animation Family Adventure JayBaruchel AmericaFerrera F.MurrayAbraham CateBlanchett GerardButler DeanDeBlois"
445629,Fighting with My Family,"Born into a tight-knit wrestling family, Paige and her brother Zak are ecstatic when they get the once-in-a-lifetime opportunity to try out for the WWE. But when only Paige earns a spot in the competitive training program, she must leave her loved ones behind and face this new cutthroat world alone. Paige's journey pushes her to dig deep and ultimately prove to the world that what makes her different is the very thing that can make her a star. Comedy FlorencePugh LenaHeadey NickFrost VinceVaughn JackLowden StephenMerchant"
464504,A Madea Family Funeral,"A joyous family reunion becomes a hilarious nightmare as Madea and the crew travel to backwoods Georgia, where they find themselves unexpectedly planning a funeral that might unveil unpleasant family secrets. Comedy CassiDavis PatriceLovely TylerPerry JenHarper DerekMorgan TylerPerry"
570744,Greta,"Pedro, a 70-year-old gay nurse, is taking care of Daniela, his ailing transgender friend. In order to find her a vacant hospital bed, he decides to help an arrested and wounded criminal to escape. Drama MarcoNanini DeniseWeinberg DémickLopes GrettaStarr RobérioDiógenes ArmandoPraça"
399361,Triple Frontier,"Struggling to make ends meet, former special ops soldiers reunite for a high-stakes heist: stealing $75 million from a South American drug lord. Action Thriller Crime Adventure BenAffleck OscarIsaac CharlieHunnam GarrettHedlund PedroPascal J.C.Chandor"
299537,Captain Marvel,"The story follows Carol Danvers as she becomes one of the universe’s most powerful heroes when Earth is caught in the middle of a galactic war between two alien races. Set in the 1990s, Captain Marvel is an all-new adventure from a previously unseen period in the history of the Marvel Cinematic Universe. Action Adventure Science Fiction BrieLarson SamuelL.Jackson BenMendelsohn JudeLaw AnnetteBening RyanFleck"
492565,The Kid,"New Mexico Territory, 1880. Rio Cutler and his older sister Sara must abandon their home after an unfortunate event happens. In their desperate flee to Santa Fe, they cross paths with the infamous outlaw Billy the Kid and his gang, who are ruthlessly pursued by a posse led by Sheriff Pat Garret. Western Drama Action EthanHawke DaneDeHaan JakeSchur LeilaGeorge AdamBaldwin VincentD'Onofrio"
400157,Wonder Park,"A young girl named June with a big imagination makes an incredible discovery -- the amusement park of her dreams has come to life. Filled with the world's wildest rides operated by fun-loving animals, the excitement never ends. But when trouble hits, June and her misfit team of furry friends begin an unforgettable journey to save the park. Comedy Animation Adventure Family Fantasy JenniferGarner MatthewBroderick JohnOliver MilaKunis KenanThompson DylanBrown"
519473,Nancy Drew and the Hidden Staircase,"Nancy Drew, a smart high schooler with a penchant for keen observation and deduction, stumbles upon the haunting of a local home. A bit of an outsider struggling to fit into her new surroundings, Nancy and her pals set out to solve the mystery, make new friends, and establish their place in the community Crime Family Mystery SophiaLillis SamTrammell LindaLavin ZoëRenee MackenzieGraham KattShea"
429471,Captive State,"Nearly a decade after occupation by an extraterrestrial force, the lives of a Chicago neighborhood on both sides of the conflict are explored. In a working-class Chicago neighborhood occupied by an alien force for nine years, increased surveillance and the restriction of civil rights have given rise to an authoritarian system -- and dissent among the populace. Science Fiction Action Horror Thriller JohnGoodman AshtonSanders JonathanMajors VeraFarmiga KevinDunn RupertWyatt"
433502,The Aftermath,"In the aftermath of World War II, a British colonel and his wife are assigned to live in Hamburg during the post-war reconstruction, but tensions arise with the German widower who lives with them. War Drama Romance KeiraKnightley AlexanderSkarsgård JasonClarke MartinCompston KatePhillips JamesKent"
527641,Five Feet Apart,"Seventeen-year-old Stella spends most of her time in the hospital as a cystic fibrosis patient. Her life is full of routines, boundaries and self-control — all of which get put to the test when she meets Will, an impossibly charming teen who has the same illness. There's an instant flirtation, though restrictions dictate that they must maintain a safe distance between them. As their connection intensifies, so does the temptation to throw the rules out the window and embrace that attraction. Romance Drama HaleyLuRichardson ColeSprouse MoisésArias KimberlyHebertGregory ParminderNagra JustinBaldoni"
500682,The Highwaymen,"In 1934, Frank Hamer and Manny Gault, two former Texas Rangers, are commissioned to put an end to the wave of vicious crimes perpetrated by Bonnie Parker and Clyde Barrow, a notorious duo of infamous robbers and cold-blooded killers who nevertheless are worshiped by the public. Crime Drama Thriller KevinCostner WoodyHarrelson KathyBates JohnCarrollLynch ThomasMann JohnLeeHancock"
536434,Red 11,A human lab rat in a sinister medical research facility tries to buy his way out of debt to the company while under the influence of experimental psychoactive drugs. Thriller Science Fiction RobyAttal LaurenHatfield CarlosGallardo AlejandroRose-Garcia EmanEsfandi RobertRodriguez
498743,Never Grow Old,"An Irish undertaker profits when outlaws take over a peaceful town, but his own family come under threat as the death toll increases dramatically. Western EmileHirsch JohnCusack DéborahFrançois DannyWebb TimAhern IvanKavanagh"
449985,Triple Threat,"A crime syndicate places a hit on a billionaire's daughter, making her the target of an elite assassin squad. A small band of down-and-out mercenaries protects her, fighting tooth and nail to stop the assassins from reaching their target. Thriller Action TonyJaa TigerHuChen IkoUwais ScottAdkins MichaelJaiWhite JesseV.Johnson"
458723,Us,"Husband and wife Gabe and Adelaide Wilson take their kids to their beach house expecting to unplug and unwind with friends. But as night descends, their serenity turns to tension and chaos when some shocking visitors arrive uninvited. Horror Thriller Mystery LupitaNyong'o WinstonDuke ShahadiWrightJoseph EvanAlex TimHeidecker JordanPeele"
416144,Hotel Mumbai,"Mumbai, India, November 26, 2008. While several terrorists spread hatred and death through the city, others attack the Taj Mahal Palace Hotel. Both hotel staff and guests risk their lives, making unthinkable sacrifices to protect themselves and keep everyone safe while help arrives. Thriller History Drama Action DevPatel ArmieHammer NazaninBoniadi TildaCobham-Hervey AnupamKher AnthonyMaras"
327331,The Dirt,The story of Mötley Crüe and their rise from the Sunset Strip club scene of the early 1980s to superstardom. Drama Music History Comedy DouglasBooth DanielWebber MachineGunKelly IwanRheon PeteDavidson JeffTremaine
329996,Dumbo,"A young elephant, whose oversized ears enable him to fly, helps save a struggling circus, but when the circus plans a new venture, Dumbo and his friends discover dark secrets beneath its shiny veneer. Family Fantasy Adventure ColinFarrell MichaelKeaton DannyDeVito EvaGreen AlanArkin TimBurton"
441384,The Beach Bum,"An irreverent comedy about the misadventures of Moondog, a rebellious stoner and lovable rogue who lives large. Comedy MatthewMcConaughey SnoopDogg IslaFisher JimmyBuffett ZacEfron HarmonyKorine"
576071,Unplanned,"As one of the youngest Planned Parenthood clinic directors in the nation, Abby Johnson was involved in upwards of 22,000 abortions and counseled countless women on their reproductive choices. Her passion surrounding a woman's right to choose led her to become a spokesperson for Planned Parenthood, fighting to enact legislation for the cause she so deeply believed in. Until the day she saw something that changed everything. Drama AshleyBratcher BrooksRyan RobiaLaMorte EmmaElleRoberts RobinDeMarco CarySolomon"
287947,Shazam!,A boy is given the ability to become an adult superhero in times of need with a single magic word. Action Comedy Fantasy ZacharyLevi MarkStrong AsherAngel JackDylanGrazer AdamBrody DavidF.Sandberg
157433,Pet Sematary,"Dr. Louis Creed and his wife, Rachel, move from Boston to Ludlow, in rural Maine, with their two young children. Hidden in the woods near the new family home, Ellie, their eldest daughter, discovers a mysterious cemetery where the pets of community members are buried. Horror Thriller JasonClarke AmySeimetz JohnLithgow JetéLaurence HugoLavoie KevinKölsch"
458131,The Best of Enemies,"Centers on the unlikely relationship between Ann Atwater, an outspoken civil rights activist, and C.P. Ellis, a local Ku Klux Klan leader who reluctantly co-chaired a community summit, battling over the desegregation of schools in Durham, North Carolina during the racially-charged summer of 1971. The incredible events that unfolded would change Durham and the lives of Atwater and Ellis forever. Drama History TarajiP.Henson SamRockwell BabouCeesay AnneHeche WesBentley RobinBissell"
972538,High Life,MichelAuder
503706,The Haunting of Sharon Tate,"Pregnant with director Roman Polanski's child and awaiting his return from Europe, 26-year-old Hollywood actress Sharon Tate becomes plagued by visions of her imminent death. Horror Thriller HilaryDuff JonathanBennett LydiaHearst TylerJohnson RyanCargill DanielFarrands"
541560,The Wind,"Lizzy is a tough, resourceful frontierswoman settling a remote stretch of land on the 19th-century American frontier. Isolated from civilization in a desolate wilderness where the wind never stops howling, she begins to sense a sinister presence that seems to be borne of the land itself, and when a newlywed couple arrive at a nearby homestead, their presence amplifies Lizzy's fears, setting into motion a shocking chain of events. Western Horror Thriller CaitlinGerard AshleyZukerman JuliaGoldaniTelles MilesAnderson DylanMcTee EmmaTammi"
527261,The Silence,"With the world under attack by deadly creatures who hunt by sound, a teen and her family seek refuge outside the city and encounter a mysterious cult. Horror Drama Thriller Fantasy StanleyTucci KiernanShipka MirandaOtto KateTrotter JohnCorbett JohnR.Leonetti"
456740,Hellboy,"Hellboy comes to England, where he must defeat Nimue, Merlin's consort and the Blood Queen. But their battle will bring about the end of the world, a fate he desperately tries to turn away. Fantasy Horror Action Adventure DavidHarbour MillaJovovich IanMcShane SashaLane DanielDaeKim NeilMarshall"
526050,Little,"Jordan Sanders, a take-no-prisoners tech mogul, wakes up one morning in the body of her 13-year-old self right before a do-or-die presentation. Her beleaguered assistant April is the only one in on the secret that her daily tormentor is now trapped in an awkward tween body, just as everything is on the line. Comedy Fantasy Romance ReginaHall IssaRae MarsaiMartin ToneBell MikeyDay TinaGordonChism"
458253,Missing Link,"The charismatic Sir Lionel Frost considers himself to be the world's foremost investigator of myths and monsters. Trouble is, none of his small-minded, high-society peers seems to recognize this. Hoping to finally gain acceptance from these fellow adventurers, Sir Lionel travels to the Pacific Northwest to prove the existence of a legendary creature known as the missing link. Family Animation Comedy Adventure Fantasy HughJackman ZoeSaldaña ZachGalifianakis StephenFry TimothyOlyphant ChrisButler"
537915,After,"Tessa Young is a dedicated student, dutiful daughter and loyal girlfriend to her high school sweetheart. Entering her first semester of college, Tessa's guarded world opens up when she meets Hardin Scott, a mysterious and brooding rebel who makes her question all she thought she knew about herself -- and what she wants out of life. Romance Drama JosephineLangford HeroFiennesTiffin ShanePaulMcGhie KhadijhaRedThunder DylanArnold JennyGage"
520679,Her Smell,A self-destructive punk rocker struggles with sobriety while trying to recapture the creative inspiration that led her band to success. Drama Music ElisabethMoss CaraDelevingne DanStevens AgynessDeyn GayleRankin AlexRossPerry
514439,Breakthrough,"Tragedy strikes when a woman named Joyce's son falls through the ice on a frozen lake and is trapped underwater for over 15 minutes. After being rushed to the hospital, the 14-year-old boy continues to fight for his life as Joyce, her husband and their pastor stay by his bedside and pray for a miracle. Drama Fantasy ChrissyMetz JoshLucas TopherGrace MikeColter MarcelRuiz RoxannDawson"
508802,Penguins,"The story of Steve, an Adélie penguin, on a quest to find a life partner and start a family. When Steve meets with Wuzzo the emperor penguin they become friends. But nothing comes easy in the icy Antarctic. Documentary Family EdHelms AlastairFothergill"
480414,The Curse of La Llorona,A social worker dealing with the disappearance of two children fears for her own family after beginning the investigation. Horror Mystery Thriller LindaCardellini RaymondCruz PatriciaVelásquez RomanChristou Jaynee-LynneKinchen MichaelChaves
450487,Fast Color,"A woman is forced to go on the run when her superhuman abilities are discovered. Years after having abandoned her family, the only place she has left to hide is home. Thriller Science Fiction GuguMbatha-Raw SaniyyaSidney LorraineToussaint DavidStrathairn ChristopherDenham JuliaHart"
515248,Someone Great,"An aspiring music journalist lands her dream job and is about to move to San Francisco when her boyfriend of nine years decides to call it quits. To nurse her broken heart, she and her two best friends spend one outrageous last adventure in New York City. Comedy Romance GinaRodriguez BrittanySnow DeWandaWise PeterVack RuPaul JenniferKaytinRobinson"
369196,I Spit on Your Grave: Déjà Vu,"Following her rape, Jennifer Hills wrote a bestselling account of her ordeal and of the controversial trial in which she was accused of taking the law into her own hands and brutally killing her assailants. In the small town where the rape and revenge took place, the relatives of the rapists she killed are furious that the court declared her not guilty and resolve to take justice into their own hands. Horror Thriller CamilleKeaton JamieBernadette MariaOlsen JimTavaré JonathanPeacy MeirZarchi"
299534,Avengers: Endgame,"After the devastating events of Avengers: Infinity War, the universe is in ruins due to the efforts of the Mad Titan, Thanos. With the help of remaining allies, the Avengers must assemble once more in order to undo Thanos' actions and restore order to the universe once and for all, no matter what consequences may be in store. Adventure Science Fiction Action RobertDowneyJr. ChrisEvans MarkRuffalo ChrisHemsworth ScarlettJohansson AnthonyRusso"
537476,I Trapped the Devil,"A man descends into paranoia after trapping what he believes to be the devil in his basement, but things take a dark turn when his family unexpectedly arrive for Christmas. Horror Mystery Drama ScottPoythress AJBowen SusanBurke JocelinDonahue ChrisSullivan JoshLobo"
555295,Body at Brighton Rock,"When an inexperienced park ranger finds a dead body under mysterious circumstances on a remote mountain trail, she must guard it overnight until authorities can arrive, forcing her to confront some of her deepest, darkest fears. Thriller KarinaFontes CaseyAdams EmilyAlthaus BrodieReed MartinSpanjers RoxanneBenjamin"
459992,Long Shot,"Journalist Fred Flarsky reunites with his childhood crush, Charlotte Field, now one of the most influential women in the world. As she prepares to make a run for the Presidency, Charlotte hires Fred as her speechwriter — much to the dismay of her trusted advisers. Comedy Romance CharlizeTheron SethRogen O'SheaJacksonJr. JuneDianeRaphael RaviPatel JonathanLevine"
524247,The Intruder,A psychological thriller about a young married couple who buys a beautiful Napa Valley house on several acres of land only to find that the man they bought it from refuses to let go of the property. Thriller MichaelEaly JosephSikora MeaganGood AlvinaAugust DennisQuaid DeonTaylor
